Task Name,Model Associated,Order,Description,Tcode Associated
Issue Goods,"4.4.4.1 Plan, transport and deliver outbound product 2.00",22,Goods Issue is automatically posted for the intermediate plants in case of X-docking,"Fiori MMBE: Display Stock Overview (Application),
Fiori VL02N: Change Outbound Delivery. Change Returns Delivery (Application)"
Issue IC PO,4.1.7.3 Establish dynamic deployment policies 2.00,36,An IC PO is issued in case there is so that stock can be released from one location to the other.,
Issue Non-Conforming Material Purge Order,13.3.3.3.2C Material purge process 1.00,11,"The Supplier Quality Engineer updates the quantities in 1490 Form 2 “Non-Conforming Material Purge Order” (Record using SAP transaction MB52.
The Supplier Quality Engineer issues “1490 Form 2 Non-Conforming Material Purge Order” to the owners of the respective departments that are in charge of the affected quantities.
1490 Form 2 serves to record and consolidate the affected part numbers and quantities in various locations along the supply chain and it also provides the screening criteria to the location owners.",Email (Application)
Issues with Drawing or BOM?,4.3.2.2F Execute detailed line schedule (exception handling 1.00,12,,
Judge and approve fallout list / additional material request,4.4.2.6 Salvage or repair returned products (CKM Kit Cleaning) 1.00,38,"Key activities:
Study supplier fallout list / additional material request taking number of cleaning cycles into account
Contact cleaning supplier directly in case of questions
Approve or reject request and propose alternative solution",
Label additional inventorised material,4.4.3.5 -GSNIA Track Inventory Accuracy (Goods Scrap Notification Inventory Adjustment) 1.00,22,"Key activities:
Print the part label(s) and stick it to item(s)",SAP ZLE_LABEL_COCKPIT: Print Pick Label (Application)
LE Shipment (consolidation),"4.4.4.1 Plan, transport and deliver outbound product 2.00",20,LE: Logistic Execution,"Fiori VT01N: Create Shipment (Application),
Fiori VT02N: Change Shipment DEPRECATED (Application),
SAP VT70: Output for Shipments (Application)"
Leave costs in AUC,9.3.3.3 -AA ADD Process and record fixed-asset additions and retires (Additions) 1.00,1,"if no final asset number is created, WBS remains unteco, the cost will be settled to AUC asset number.",Fiori S_ALR_87011990: History Sheet - Classic (Application)
Level 1 approval,"13.3.3.1E.2 SPDA(Short Ship Deviation-Type 1)GOPS 8200,3300,GSS 3118 Ariba supplier 1.00",42,,
Level 1 approval,"13.3.3.1E.1 SPDA (Non short ship-Type 1)GOPS 8200,3300,GSS 3118 Ariba supplier 1.00",39,Level 1 approval,"Fiori F0312: Quality Notification for Quality Engineer (Application),
Fiori QM02: Change Quality Notification for Quality Engineer (Application)"
Level 1 approval,"13.3.3.1E.2 SPDA(Short Ship Deviation-Type 1)GOPS 8200,3300,GSS 3118 Ariba supplier 1.00",10,,
Level 1 approval,"13.3.3.1E.1 SPDA (Non short ship-Type 1)GOPS 8200,3300,GSS 3118 Ariba supplier 1.00",5,MFG Engineering approval,"Fiori F0312: Quality Notification for Quality Engineer (Application),
Fiori QM02: Change Quality Notification for Quality Engineer (Application),
Fiori QM03: Display Quality Notification (Application),
SAP ARIBA - SCC - QM (Application)"
Level 2 review,"13.3.3.1E.2 SPDA(Short Ship Deviation-Type 1)GOPS 8200,3300,GSS 3118 Ariba supplier 1.00",71,,
Level 2 review,"13.3.3.1E.2 SPDA(Short Ship Deviation-Type 1)GOPS 8200,3300,GSS 3118 Ariba supplier 1.00",56,,"Custom Fiori App (Application),
Fiori QM02: Change Quality Notification for Quality Engineer (Application)"
Level 2 review and approval,"13.3.3.1E.1 SPDA (Non short ship-Type 1)GOPS 8200,3300,GSS 3118 Ariba supplier 1.00",21,Level 2 review and approval,
Level Capacity,4.3.1.3 -PPDS Lean PP Generate detailed schedule (Production Planning and Detailed Scheduling) 2.00,10,"Key actions:
Level Capacity
App: Capacity Scheduling Table",SAP CM21: Capacity leveling. SFC planning table (Application)
Link Engineering Spec Waiver to Shop floor order,13.3.3.3.2D QN use as is follow up 1.00,29,,Fiori CO02: Change Production Order for Production Supervisor - Discrete Manufacturing (Application)
Link Order Specification,3.5.4.4A OFE ER Phase: Creation [10] + Order Intake [20] 2.00,34,"Key Activities: In the SAP Web UI: Link the DIR of the OSF to the Existing ER
Select: Menu: Engineering Record (a.k.a: ER) > Display ER
On the screen: Display ER:
- Enter: ER number.
Use the button: Continue.
The ER will be displayed.
Use the button: Edit
- Select the tab: DocumentS.
- Ensure the: Show Version pull down is set to: All
- Select a blank line: Use to double box icon to search for the DIR no.
- Highlight and select the desired DIR version in the search results
Use the button: Save
The ER update will be stored in SAP.
This completes the task of: Linking the Order Specification.",SAP IPS OFE Workflow (Order Fullment Equipment Engineering Record) (Inteligent Process System -Workflow engine by LeverX-) (Application)
Link the relevant requirements with ASM Policies,11.2.2.2 Identify applicable regulatory requirements 1.00,7,Identify the key aspects of the relevant laws and regulations and accordingly link them with existing global or local policies.,ASM Processes Library (BMS) (Application)
List current open PO's,4.2.3.4D Manage Purchasing Price (Freight adder) 3.00,15,,
List Missing Items,"4.4.3.4 Pick, pack, and ship product for delivery 1.00",46,"Could lead to SSD,
Not all items handed over from Production",
Load Demand,4.1.3.1 -MRP Create Unconstrained Plan 2.00,13,"Load Demand via
CJ20N Stock Type Q-Project Stock (WBS Type : DEM, DMR, RFB)
ZVC_SORE Stock Type E-Sales Order Stock (EQM, EVT,RFK)
After Loading Demand, auto drop will be triggered.","Fiori CJ20N: Project Builder (Application),
SAP MS01: Long-Term Planning Total Planning (Application),
SAP ZVC_SOREL: Release VC-related Demand in SO (Application)"
Load plan price 3 and date in Material Master,9.1.2.4 -EXT BUY Perform product costing (Existing Buy Part) 1.00,35,,SAP ZFI_STDCOST_UPD: Material Cost and P-S Status Update (Application)
Lock accounting period,9.3.4.8C Perform legal and management consolidation (Consolidation & Reporting) 1.00,11,Lock Period for Respective Version in Consolidation Monitor (CX20),Fiori CX20: Consolidation Monitor (Application)
Lock/ Close Condition Contract,9.2.2.2 -REBATE Generate customer billing data (Customer Rebate) 2.00,16,"once final settlement will be done, system will automatically lock the contract",
Maintain approved Capex budget,9.4.1.2 Develop and approve capital expenditure plans and budgets 1.00,1,Maintain the approved Capex Budget spending in the System for Budget (Original / Supplement / Return) in the investment program in SAP.,"SAP IM30: Change Supplement to Inv.Prog.Pos. (Application),
SAP IM32: Change Budget Inv. Prog. Position (Application),
SAP IM38: Change return on program position (Application)"
Maintain bidders list,4.2.3.1 Select Suppliers 1.00,2,For details see referred GP130: Supplier Onboarding (Selection and Qualification),SAP ZMM_BIDDERS_LIST: Maintain Staging Table Bidders List (Application)
Maintain BOM,4.1.1.7 MBOM Creation and Update Request 2.00,6,,Fiori CS02: Change Bill of Material (Application)
Maintain budget return,9.4.2.3 Monitor and track capital projects and budget spending 1.00,14,,Fiori CJ38: Edit Budget Return - Projects for Cost Accountant - Overhead (Application)
Maintain Buffer Profile,4.1.1.6 -DDMRP Define Production Network & Supply Constraints 2.00,10,,Fiori PPH_DD_BUF_PROF: Buffer Profile Maintenance (Application)
Maintain My Area of Responsibility MRP Controllers,4.1.1.6 -MRP Define Production Network & Supply Constraints 1.00,2,,Fiori F4796: My Area of Responsibility - MRP Controller for Production Planner (Application)
Maintain original budget in WBS levels,9.4.2.3 Monitor and track capital projects and budget spending 1.00,3,,Fiori CJ30: Edit Original Budget - Projects for Cost Accountant - Overhead (Application)
Maintain performance obligation (POB) for product in BRF+,9.3.2.4 -RAR Process period end adjustments (RAR) 1.00,3,,
Maintain Plan Activity Quantity,9.1.2.4 -ACVT RATE Perform product costing (Maintain Activity Rate) 1.00,15,Upload the budgeted production hours,"Fiori KP26: Edit Prices for Activity Types - Cost Centers for Cost Accountant - Overhead (Application),
SAP S_ALR_87013611: Cost Centers: Actual/Plan/Variance (Application)"
Maintain Plan Activity Rate,9.1.2.4 -ACVT RATE Perform product costing (Maintain Activity Rate) 1.00,9,"Activity rates calculated during budget.
Activity rates for fixed and variable overheads are maintained with nominal value.",Fiori KP26: Edit Prices for Activity Types - Cost Centers for Cost Accountant - Overhead (Application)
Maintain Plan Cost,9.1.2.4 -ACVT RATE Perform product costing (Maintain Activity Rate) 1.00,22,Upload the budget cost centers data,SAP KP06: Change CElem/Activity Input planning (Application)
Maintain Planning Parameters,4.1.1.6 -MRP Define Production Network & Supply Constraints 1.00,5,,FIori SPRO: Customizing - Edit Project (Application)
Maintain replacement parts,4.2.4.4A Create/Distribute Purchase Orders 2.00,41,,Fiori MSR_VRM_GR: Receive Replacement Materials - From Vendor (Application)
Maintain Routings,4.1.1.7 MBOM Creation and Update Request 2.00,18,,Fiori CA02: Change Routing for Production Engineer - Discrete Manufacturing (Application)
Maintain Standalone Selling Price (SSP),9.3.2.4 -RAR Process period end adjustments (RAR) 1.00,2,,Fiori VK11: Create Condition (Application)
Maintain Supersession master data for Products (App: Manage Substitution - Products,4.1.5.1 -SP Maintain Master data 2.00,36,,"Fiori F4785: Manage Substitutions for Master Data Specialist - Product Data (Application),
Fiori VB11: Create Material Determination Records for Internal Sales Representative (Application),
SAP /SAPAPO/SPPSUSEXPL: Product Substitution Explanation (Application),
SAP PROD_SUBSTN_UPLOAD: Prod. Substn. Excln. upload (Application),
SAP ZESPP_SS_GENFILE: ZESPPR_CREATE_SS_INPUTFILE (Application)"
Maintain supplement amount in budget code,9.4.2.3 Monitor and track capital projects and budget spending 1.00,17,,Fiori CJ36: Post Budget Supplement to Project - Projects for Cost Accountant - Overhead (Application)
Maintain Suppy Chain Initiatives Tracking List,4.2.2.1 R&C Develop sourcing and category management strategies 1.00,22,"Information is kept in the Supply Chain Initiatives Tracking overview by Director, ODAS (Operations Data, Analytics and System), summarizing the key suppliers and the status of the key initiatives such as SRS scorecard, D&B scorecard, Master Purchase Agreement status, RBA, Supplier Scorecard, SBR, audit. If applicable follow up action is taken which consists of updating the supplier classification.",
Maintain Work Instructions,4.1.1.7 MBOM Creation and Update Request 2.00,4,,
Make a decision to initiate a Non-Conforming material purge,13.3.3.3.2C Material purge process 1.00,6,"Supplier Quality Engineer (SQE) or Product Support Engineer starts Non-Conforming Material Purge after receiving official escalation via: a Customer Complaint; Safety issue (GP 105); Non-Conformance report (GP 104); Failure Analysis report (GP 201); or Non-conforming Material found during Manufacturing via SAP Quality Notification (WI 1534)).
Scenarios for initiating a material purge are when there is an unacceptable risk for:
Safety
Wafer scrap
Tool down
Quality escape leading to customer impact
Quality escape leading to ASM operational and/or cost impact
Legal implications to ASM
Questionable materials that identified as a possible deviation from as-built",Fiori QM02: Change Quality Notification for Quality Engineer (Application)
Make and release standard cost for Make Parts,9.1.2.4 -EXT SP Perform product costing (Existing Spare Part) 1.00,18,,Fiori CK40N: Edit Costing Run for Cost Accountant - Inventory (Application)
Make Kit/Dis-assemble kit,4.3.2.5D Monitor and optimize production process (Spares) 2.00,3,,
Make necessary adjustments to the Open Commitment Report,9.3.1.5 Establish common financial systems (FCC) 1.00,36,,
Manage Delivery to NBD (Need By Date),4.2.4.4B Distribute Purchase Order 2.00,43,"When the supplier commits to a different delivery date than Need By Date (NBD), the delivery escalation process is triggered with the purpose to align these dates as much as possible.
If during the delivery escalation process, a mutual agreement is reached, the buyer updates the new delivery date in S4/Hana. On a weekly basis, upon the update of the MRP the new dates are communicated with the supplier through ARIBA or the Open Order Report (OOR) for non-ARIBA suppliers for commitment.",
Manage I&Q budget and Conforming hours inside power app (Sharp),5.3.1.7 -IQ Create Service Order ZMIQ: Install & Qualification 2.00,14,"Key Activities:
IQ manager will update the planned IQ budget and planned hours inside Power App (Sharp)",Power App (SHaRP) (Application)
Manage revenue accounting item,9.3.2.4 -RAR Process period end adjustments (RAR) 1.00,7,,"Fiori F4270: Manage Revenue Accounting Items for Revenue Accountant (Application),
SAP ZFI_POST_UTIL: RAR - Posting Utility (Application)"
Manage revenue contract,9.3.2.4 -RAR Process period end adjustments (RAR) 1.00,10,,Fiori F3883: Manage Revenue Contracts for Revenue Accountant (Application)
Manual change booked hours,5.3.2.6E Time Booking 2.00,7,,SAP CAT2: Time Sheet: Maintain Times (Application)
Manual Reverse Parts consumption,5.3.3.5 -RP>PD Change non Paid (ZMRP) to Paid (ZMPD) Service Order 1.00,37,,Fiori MIGO: Goods Movement. Post Goods Movement (Application)
Manual Sync,2.5.1.2.1 Setup MBOM 1.00,17,ME engineer manually sync EBOM to MBOM,
Manual time booking in CAT2,5.3.3.5 -RP>PD Change non Paid (ZMRP) to Paid (ZMPD) Service Order 1.00,10,,SAP CAT2: Time Sheet: Maintain Times (Application)
Manually Create/ Update Measurement Document,6.2.4.1 -SP Process returns (ARM) 1.00,15,"'-Any wrong measurement document created via FSM should be corrected by FSE manually in S/4 directly
-Any wrong measurement document created directly via S/4(manual by CSR) should be corrected by CSR","Fiori IK11: Create Measuring Document (Application),
Fiori IK12: Change Measurement Document (Application)"
Manually reschedule production orders,4.3.1.4 Reschedule Production Orders 2.00,26,"Perform manual re-scheduling of production orders
T-code: /SAPAPO/CDPS0
App: Advanced Scheduling Board","Fiori F5460: Advanced Scheduling Board (Application),
SAP /SAPAPO/CDPS0: DPS Variable View (Application)"
Manually trigger GTS compliance rechecks,11.2.2.6C R&C Monitor and test regulatory compliance position and existing controls (Blocked Sales Transactions) 1.00,17,,SAP /SAPSLL/CUHD_MR_EXP: Recheck Export Customs Documents (Application)
Map each part to products,4.2.2.3 R&C Critical & constrained parts 1.00,3,,
Map new GL Account to FS Item,9.3.4.8A Perform legal and management consolidation (Preparatory Activity) 1.00,10,Map the new GL Account to FS Item in Map FS Items with G/L Accounts Application (F3333),Fiori F3333: Map FS Items with G/L Accounts for General Ledger Accountant - Group Reporting (Application)
Mark and release standard cost for Make Parts,9.1.2.4 -EXT MAKE Perform product costing (Existing Make Part) 1.00,17,,Fiori CK40N: Edit Costing Run for Cost Accountant - Inventory (Application)
Mark approved Accrual Object,9.3.2.4 -ACCRUAL Process period end adjustments (Accrual Engine) 1.00,12,,Fiori FACRAAPPRVGL: Approve Periodic Accruals – G/L Accountants (Application)
Mark material as unconstrained,4.1.2.4A Develop available to promise Build Plan 1.00,19,,
"Mark NC as ""Closed"" in Power BI and Tiger SI Checklist",4.3.3.5 R&C Take corrective or preventive action 1.00,8,,Power BI (Microsoft) (Application)
Mark physical item(s) and move them to Problematic Goods location,4.4.2.2 -PGR Manage Inbound Material Flow (Problematic Goods Receipt) 1.00,20,,
Mark physical item(s) as scrap and move them to scrap bin or location,4.4.3.5 -GSNIA Track Inventory Accuracy (Goods Scrap Notification Inventory Adjustment) 1.00,24,"Key Activities:
Mark items as scrap by attaching the GSNIA form
Prepare the physical items for collection by moving them to location",
Mark standard cost,9.1.2.4 -EXT SP Perform product costing (Existing Spare Part) 1.00,9,,Fiori CK40N: Edit Costing Run for Cost Accountant - Inventory (Application)
Mark standard cost,9.1.2.4 -EXT BUY Perform product costing (Existing Buy Part) 1.00,47,,Fiori CK40N: Edit Costing Run for Cost Accountant - Inventory (Application)
Mark TBD slot as Not Relevant,4.1.2.1 -EQ-TBD Develop baseline demand forecast - Demand Adjustment 1.00,14,,
Marked task completed in FCC,9.3.1.5 Establish common financial systems (FCC) 1.00,12,Marked task completed in FCC without errors,
Mass convert Planned Orders to Production Orders,4.3.1.2 Generate line level plan (Prod.Ord. create and modify) 2.00,18,"Mass convert planned orders to production orders in SAP
(T-code: ZCO41 or CO41)
Order Type - Description
EQUI - Equipment Order
RWRK - Rework Order
RFUB - Refurbishment Order
RETR - Retrofit Order
IHTR - In-House Training Order
CMFG - Contract Manufacturing Order (Outsourced)
CAPX - In-House Manufacturing Order (CAPEX)
Planned order from MRP run in ESPP:
Planned Order type will be for KITS and DKIT
production order will inherit order type
ZCO41: Collective Conversion of production orders with production version.","Fiori CO10: Production Order with Project - Create (Application),
Fiori CO40: Converting Planned Order - to Production Order (Application),
Fiori CO41: Convert Planned Orders to Production Orders (Application),
SAP ZCO41: Collective Conversion of Plan Order (Application)"
Mass Create Inspection Plans,4.1.8.2A Inspection Plan 2.00,2,,
Mass Create/Change Routing,4.1.1.7B Define Production Process (Routing) 3.00,1,,SAP ZP02: Batch Upload of Routing (Application)
Mass Maintain Work Center Capacities,4.1.1.5 -EQ Define Capacities 2.00,21,"Workcenter administrator Changes Work Center capacities in SAP
to what based on what information (Input)",Fiori F5381: Mass Maintenance Of Work Center Capacities for Production Planner (Application)
Mass Maintenance of Products,4.1.1.6 -DDMRP Define Production Network & Supply Constraints 2.00,8,,Fiori F2825: Mass Maintenance of Products (DD) for Production Planner (Application)
Match receipt against invoices,9.2.3.2 -AR Receive/Deposit customer payments (Process Customer Incoming Payments) 1.00,25,EBS workbench to match the receipts against the invoice/invoices based on the variants set.,SAP /BPICS/EBS_WB: EBS Workbench (Electronic Bank Statement) (Application)
Material Extension Process (TBC),3.5.4.5A Enter Sales Orders into system 1.00,84,,
MFC Price Check,3.5.4.5A Enter Sales Orders into system 1.00,76,MFC = Most Favorite Customer,
Monitor Closing Tasks,9.3.1.5 Establish common financial systems (FCC) 1.00,5,Monitor Closing Tasks in FCC based on FCC KPI Reports,"Fiori F3699: Close Delay (Application),
Fiori F3700: Plan Actual Comparison (Application),
Fiori F3701: Omitted Tasks (Application),
Fiori F3702: Erroneous Tasks (Application),
Fiori F3844: Close Evolution (Application),
Fiori FCLOCO: Process Closing Tasks (Classic) - SAP S/4HANA Financial Closing cockpit (Application),
S/4HANA - FCC (Financial Closing Cockpit) (SAP) (Application)"
Move goods physically from origin to destination location,4.4.3.8B Manage Warehouse Transfers (from IM warehouse) 2.00,11,,
Move goods physically from origin to destination location,4.4.3.8C Manage Warehouse Transfers (IM2IM) 1.00,5,,
Move goods to quality inspection,4.4.2.2B Manage Inbound Material Flow (distribution) 1.00,14,,
Move material to MRB,13.3.3.1D -MFG Assess potential impact (MFG QNs) 1.00,32,,
Move material to MRB location,13.3.3.1 -IC Assess potential impact (Incoming Quality QN) 1.00,5,,Fiori MIGO: Goods Movement. Post Goods Movement (Application)
Move material to Production Review Board (PRB) location,13.3.3.1D -MFG Assess potential impact (MFG QNs) 1.00,6,"Detected at IQC- QN Type F2- Material Transfer from 924Q to MRB via inspection lot
Detected at warehouse- QN Type -ZD- Material Transfer from WH storage location to MRB via 311 transfer
Detected at Production-QN Type Q3-Material Transfer via SFO into MRB
Detected at BPS/Shipping -QN Type ZD- Material Transfer from Shipping location to PRB via 311 transfer
Detected at Contract Manufacturing-Type Q7-Transfer from Subcontractor to MRB by Warehouse
Detected at Vendor (Customer to ASM) (Buy-Sel)-Type Q7-Material Upon DN created Transfer into MRB by WH",Fiori MIGO: Goods Movement. Post Goods Movement (Application)
Move material to SECD warehouse location,4.4.2.2E First Article Inspection (First Article GR Inspection - Physical Verification) 1.00,23,"SECD: SEcond sourCeD Dedicated warehouse location for second source materials
Status reset to new in QIR",Fiori MIGO: Goods Movement. Post Goods Movement (Application)
Move QN status to returned,13.3.3.1 -FS Assess potential impact (Field Services QN) 1.00,11,"When there is not enough information to proceed, additional input should be asked from the QN submitter.",Fiori QM02: Change Quality Notification for Quality Engineer (Application)
Move RTS parts from production to warehouse,4.3.2.1 Manage raw material inventory (Material Movements from Mfg Floor) 2.00,18,Move RTS parts from production to warehouse with the Production Order Number,
Move the material back to warehouse,13.3.3.3.2D QN use as is follow up 1.00,19,,Fiori MIGO: Goods Movement. Post Goods Movement (Application)
Move the material to MRB location in the system as well as physical,13.3.3.3.2C Material purge process 1.00,2,,Fiori MIGO: Goods Movement. Post Goods Movement (Application)
Move to inventory location 0900,4.1.7.3 Establish dynamic deployment policies 2.00,31,Excess parts are moved to inventory location 0900 so that all regions can use the parts,
Negotiate with Customer,3.3.3.3B R&C Determine pricing based on volume/unit forecast 1.00,3,,
Negotiate with suppliers,4.2.3.3 -CONTRACT Negotiate and establish contracts 1.00,3,,
Negotiate with suppliers,4.2.3.3 -SCHEDULING Negotiate and establish contracts 2.00,2,,
Notify about service order type change,5.3.3.5 -PD Complete Service Order ZMPD: PaiD 1.00,23,"Key Activites:
Service manager to inform service head if any paid service order type change.",Email (Application)
Notify business control team activity type has been created,9.1.3.1 -AT Determine key cost drivers (Maintain Activity Type) 1.00,18,,
Notify buyer and the SQE on the part arrival,"13.3.3.1B -FA Assess potential impact (Failure Analysis QN, prioritize, logistics and assign owner)) 1.00",1,,
Notify FSS AP Team when batch job is completed,9.6.1.3 -CTSI Audit invoices and key data in AP system (CTSI) 1.00,6,There will be an email to inform FSS AP team when batch job is completed.,MS Outlook (Application)
Notify FSS of rejected request,9.1.3.1 -CC Determine key cost drivers (Maintain Cost Center) 1.00,9,Notify FSS the request has been rejected.,
Notify HR on updated cost center,9.1.3.1 -CC Determine key cost drivers (Maintain Cost Center) 1.00,26,HR is notified that cost center has been created to be able to attach the employee.,
Notify MDM request has been rejected,9.1.3.1 -AT Determine key cost drivers (Maintain Activity Type) 1.00,29,,
Notify Mfg Eng & Prod Planner,4.3.2.1 Manage raw material inventory (Material Movements from Mfg Floor) 2.00,14,Inform Mfg Engg & Planners the list of RTS items,
Notify QN submitter,13.3.3.5 Close non-conformance 1.00,16,,
Notify QN submitter,13.3.3.5 Close non-conformance 1.00,2,,
Notify requester of completed internal order request and number,9.1.3.1 -IO Determine key cost drivers (Maintain Internal Order) 1.00,11,"Once it’s completed, GL Accountant to inform the requester on the completion of the request.",
Notify requester requested activity types have been created,9.1.3.1 -AT Determine key cost drivers (Maintain Activity Type) 1.00,16,,
Notify Requestor on completed cost center request,9.1.3.1 -CC Determine key cost drivers (Maintain Cost Center) 1.00,33,"Once it’s completed, the requester is informed on the completion of the request.",
Notify requestor that request is approved,9.7.3.1 -MSTR Manage in-house bank accounts for subsidiaries (Manage Bank Master) 2.00,37,Notification will be sent to MDM Team to continue the process to create new Bank Master with approval,
Notify requestor that request is rejected,9.7.3.1 -MSTR Manage in-house bank accounts for subsidiaries (Manage Bank Master) 2.00,39,"Bank Master (Bank Key) will not be created, and notification will be sent to the requestor that the request is rejected.",
Notify Supplier,13.3.3.1 -SCR Assess potential impact (Supplier change request) 1.00,8,Supplier gets notification via SAP EPD that the SCR has been rejected or approved.,
Notify Vendor / Buyer on impacted invoices,9.6.1.11 -PAY REV Adjust accounting records (Payment reversal) 1.00,5,,
Obsolete PBI report from Power BI workspace and in PBI apps,13.8.10.1 Control BIA program 1.00,25,,
Obtain approval in accordance to GAM,9.2.1.5 Review Existing Accounts (Process Credit Limit for Customer) 1.00,21,Obtain approval in accordance to GAM,Fiori UKM_MY_DCDS: Manage Documented Credit Decisions (Application)
Obtain approval in accordance to GAM,9.2.1.5 Review Existing Accounts (Process Credit Limit for Customer) 1.00,33,Obtain approval for credit limit changes per GAM. Approval is via workflow in S/4,Fiori UKM_MY_DCDS: Manage Documented Credit Decisions (Application)
Obtain confirmation of completed GR reversal,9.1.2.4 -EXT BUY Perform product costing (Existing Buy Part) 1.00,28,,MS Outlook (Application)
Obtain confirmation of completed PIR correction,9.1.2.4 -EXT BUY Perform product costing (Existing Buy Part) 1.00,12,,MS Outlook (Application)
