Task Name,Model Associated,Order,Description,Tcode Associated
Reverse Journal Entry Asset,"9.3.3.4 -AA TRSF Process and record fixed-asset adjustments, enhancements, revaluations and transfers 1.00",9,,Fiori AB08: Reverse Journal Entry - Asset Accounting-Specific for Asset Accountant (Application)
Reverse Non-Cleared Documents,9.2.3.2 -REV Receive/Deposit customer payments (AR Document Reversal) 1.00,4,"If non-cleared item, FSS AR team to reverse the non-cleared document (posted reversal)","Fiori F0711: Manage Customer Line Items for Accounts Receivable Accountant (Application),
Fiori FB08: Reverse Document (Application)"
Reverse original journal entry,9.3.2.2 -REV Process journal entries (Reversal Document) 1.00,13,,"Fiori F0717: Manage Journal Entries for General Ledger Accountant (Application),
Fiori FB08: Reverse Document (Application)"
Reverse Payment,9.6.1.11 -PAY REV Adjust accounting records (Payment reversal) 1.00,3,Reset Cleared Items,Fiori FBRA: Reset Cleared Items - FBRA (Application)
Reverse Rebate Settlement,9.2.2.2 -REBATE Generate customer billing data (Customer Rebate) 2.00,21,tcode: WZR4,Fiori WZR4: Reverse Settlement Document (Application)
Reverse settlement,9.1.2.6 Report on profitability 1.00,34,"scenario
X-year yes/no
x-year no (straight forward)
x-year yes reclass",
Reverse time booking,5.3.3.5 -PD>RP Change paid (ZMPD) to non paid (ZMRP) Service Order 1.00,17,,SAP CAT2: Time Sheet: Maintain Times (Application)
Reverse time booking In CAT2,5.3.3.5 -RP>PD Change non Paid (ZMRP) to Paid (ZMPD) Service Order 1.00,20,,SAP CAT2: Time Sheet: Maintain Times (Application)
Reverse/ Update settlement,9.1.2.8 (#TBD#) Project Type Change 1.00,23,,Fiori CJ20N: Project Builder (Application)
Revert TECO,5.3.3.5 -RP>RP Change Service Order ZMPR PM Activity Type 1.00,17,TECO: TEchnical COmplete,Fiori IW32: Change Maintenance Order (Application)
Revert TECO,5.3.3.5 -RP>PD Change non Paid (ZMRP) to Paid (ZMPD) Service Order 1.00,29,,Fiori IW32: Change Maintenance Order (Application)
Revert TECO Status,5.3.3.5 -PD>RP Change paid (ZMPD) to non paid (ZMRP) Service Order 1.00,28,"Key Activities:
Contact key user (Colleen's team) to revert TECO (TEchnical ClOsure)",Fiori IW32: Change Maintenance Order (Application)
Review,"13.3.3.1E.2 SPDA(Short Ship Deviation-Type 1)GOPS 8200,3300,GSS 3118 Ariba supplier 1.00",68,,
Review & approve document and add to order BOM,3.5.4.4C OFE ER Phase: Final Documentation [50] 1.00,13,Key activities:,
Review & Confirm Work Complete,4.1.1.7 MBOM Creation and Update Request 2.00,14,,
Review (update) RBA SAQ risk rating,13.7.2.2 Assess future risks and opportunities 1.00,9,"Coordinate meeting(s) with EHS and People Leaders and Sr. Managers to review the answers and ensure global alignment. Communicate and obtain site leaders agreement for any changes and edition.
If applicable update the RBA SAQ",
Review (update) RBA SAQ risk rating,12.2.3.1 Evaluate the requirements for strategic requirements 1.00,9,"Coordinate meeting(s) with EHS and People Leaders and Sr. Managers to review the answers and ensure global alignment. Communicate and obtain site leaders agreement for any changes and edition.
If applicable update the RBA SAQ",
Review Accrual list,9.3.2.4 -ACCRUAL Process period end adjustments (Accrual Engine) 1.00,17,BU/SU Controller to review the list from Accounts Payable Invoice Accountant and check the approval box in the proposal per line item.,Fiori FACRAAPPRVGL: Approve Periodic Accruals – G/L Accountants (Application)
Review Activity Rate report,9.1.2.4 -ACVT RATE Perform product costing (Maintain Activity Rate) 1.00,10,,Fiori KSBT: Analyze Prices for Activity Types - Cost Centers for Cost Accountant - Overhead (Application)
Review actual costs calculations,9.1.2.1 -ADHOC3 ANALYSIS Perform inventory accounting (Adhoc Cost Analysis) 1.00,29,,
Review Aggregated/Raw Demand history in eSPP Planning views,4.1.2.1 -SP Develop baseline demand forecasts 2.00,11,,"SAP /SAPAPO/RAWDEM_CHG: SPP Demand-history adjustment (Application),
SAP /SAPAPO/SPPDMDH: SPP Demand History (Application),
SAP /SAPAPO/SPPDMRD: SPP Raw Data Adjustment (Application)"
Review all existing opportunities,4.1.2.1 -EQ-TBD Develop baseline demand forecast - Demand Adjustment 1.00,3,,
Review and approval,"13.3.3.1E.1 SPDA (Non short ship-Type 1)GOPS 8200,3300,GSS 3118 Ariba supplier 1.00",18,Review SPDA request,
Review and approval,"13.3.3.1E.1 SPDA (Non short ship-Type 1)GOPS 8200,3300,GSS 3118 Ariba supplier 1.00",52,,
Review and approval task,"13.3.3.1E.2 SPDA(Short Ship Deviation-Type 1)GOPS 8200,3300,GSS 3118 Ariba supplier 1.00",53,,"Custom Fiori App (Application),
Fiori QM02: Change Quality Notification for Quality Engineer (Application)"
Review and Approve Forecast,4.1.2.6 -SP Evaluate and revise demand forecasting approach 2.00,24,,"Fiori /SAPAPO/SPPFCSTAPPR: Approve Forecast for Demand Planner - Service Parts (Application),
SAP ZESPP_FCSTAPPR: SPP: Forecast Queue for Manual Appro (Application)"
Review and Approve MBOM,2.5.1.2.2 Review MBOM 1.00,11,"Manager approval for the MBOM structure after reviewing of BOM structure, ER, DIRs, etc.
There are two decision options available in this task:
Approve - will result in BOM status 30
Reject - will return to the MBOM Update (Manual Synch) and Routing task",
Review and approve Open Commitment Report,9.3.1.5 Establish common financial systems (FCC) 1.00,40,"VP, Global Supply Chain reviews the outstanding purchase commitments to ensure that only existing and accurate obligations are recorded.
Review comments shared with the GOPS controller as part of the Report",
Review and approve Open Commitment Report,9.3.1.5 Establish common financial systems (FCC) 1.00,41,The Open Commitments report is submitted to Global Operations Controller for review. Respective reviewers sign-off on the report as evidence of review and approval.,
Review and approve stock list proposal,4.1.7.3 Establish dynamic deployment policies 2.00,51,,
Review and correct the FA report with supplier,"13.3.3.1C -FA Assess potential impact (Failure Analysis QN, Performing FA) 1.00",17,,Fiori QM03: Display Quality Notification (Application)
Review and modify phase out forecast,4.1.2.6 -SP Evaluate and revise demand forecasting approach 2.00,1,,SAP /SAPAPO/SPPLONGFCST: SPP Long-Term Forecasting (Application)
Review and process master data issues,4.3.1.2 Generate line level plan (Prod.Ord. create and modify) 2.00,14,"Check and Inform ME for Master Data or IT team for Technical Issue.
Scope: BOM, Routing, Production Version",
Review and provide information,"13.3.3.1E.1 SPDA (Non short ship-Type 1)GOPS 8200,3300,GSS 3118 Ariba supplier 1.00",56,"For non-shortship
CCM is an individual and there are 5 of them in total. Each of the CCM will receives a notification to approve in Fiori.
Each CCM is required to approve regardless there is impact tool or not.
Example: In SAP ECC, each CCM will have a Task and acts as an acknowledgement to be reviewed and completed.
1. CCM1 -> Approved - N/A
2. CCM2 -> Approved - Tool1
3. CCM3 -> Approved - N/A
4. CCM4 -> Approved - Tool2, Tool3
5. CCM5 -> Approved - N/A
In maintaining CCM mapping with a backup user, the solution is the same as Level 1 and 2. The maintenance access is given to Business Users.
CCM has to provide impacted Tool information",
Review and provide RMA number to return,13.3.3.1N Assess potential impact (Customer buy sell QN) 1.00,12,,Fiori QM02: Change Quality Notification for Quality Engineer (Application)
Review and update the task disposition,13.3.3.1 -IC Assess potential impact (Incoming Quality QN) 1.00,32,The follow actions are reviewed an updated by the Supplier and the disposition of the material is determined,SAP ARIBA - SCC - QM (Application)
Review and upload quotation responds,4.2.4.3 Solicit/Track Vendor Quotes 3.00,54,,SAP ZMM_RFQ_Q: Upload Supplier Quotation (Application)
Review and validate list of RTS items (Return To Stock),4.3.2.1 Manage raw material inventory (Material Movements from Mfg Floor) 2.00,25,Review and ensure list of RTS items are correct,
Review appropriation request,9.4.1.3 Review and approve capital projects and fixed-asset acquisitions 1.00,10,Approver (GAM) will approve appropriation request,SAP IMA3N: Display Appropriation Request (Application)
Review asset disposal form,9.3.3.3 -AA RETIRE Process and record fixed-asset additions and retires (Retires) 2.00,39,"As a GAM approver, Controller will review the asset disposal and supporting documents.",MS Outlook (Application)
Review asset disposal form,9.3.3.3 -AA RETIRE Process and record fixed-asset additions and retires (Retires) 2.00,22,"As a GAM approver, Controller will review the asset disposal and supporting documents.",MS Outlook (Application)
Review asset disposal form,9.3.3.3 -AA RETIRE Process and record fixed-asset additions and retires (Retires) 2.00,46,"As a GAM approver, Controller will review the asset disposal and supporting documents.",MS Outlook (Application)
Review asset disposal form,9.3.3.3 -AA RETIRE Process and record fixed-asset additions and retires (Retires) 2.00,33,"As a GAM approver, Controller will review the asset disposal and supporting documents.",MS Outlook (Application)
Review asset disposal form,9.3.3.3 -AA RETIRE Process and record fixed-asset additions and retires (Retires) 2.00,56,,MS Outlook (Application)
Review asset disposal form,9.3.3.3 -AA RETIRE Process and record fixed-asset additions and retires (Retires) 2.00,61,,MS Outlook (Application)
Review asset disposal form,9.3.3.3 -AA RETIRE Process and record fixed-asset additions and retires (Retires) 2.00,19,Approver will have to review the supporting emails and documents for the disposa;.,MS Outlook (Application)
Review asset transaction request (reversal/ transfer),"9.3.3.4 -AA TRSF Process and record fixed-asset adjustments, enhancements, revaluations and transfers 1.00",6,,MS Outlook (Application)
Review assets Under Construction for accuracy and completeness,9.4.1.3 Review and approve capital projects and fixed-asset acquisitions 1.00,33,"The Assets under Construction listing which details the project start date, budget cost, person responsible and explanations including completion date for balances >6months, is prepared by the respective Business Units Finance teams. The respective Controllers review the AUC listing (visibly reconciled to GL for accuracy and completeness purposes), to ensure that completed assets are transferred and depreciation computed correctly and timely.
Upon confirmation of completion of AUC by BU Finance, the details of the AUC are prepared and capitalised into the asset cost by FSSC GL Team.",
Review balance carry forward status,9.3.2.4 -YrEnd CarryFwd Process period end adjustments 1.00,5,Check balance carry forward status if the correct Year-End balances are correctly rolled forward for each Subledgers (AP/AR/AA),Fiori S_ALR_87012277: G/L Account Balances - S_ALR_87012277 (Application)
Review balance carry forward status,9.3.1.5 Establish common financial systems (FCC) 1.00,13,Check balance carry forward status if the correct Year-End balances are correctly rolled forward for each Subledgers (AP/AR/AA),
Review bank account request via Email,9.7.3.1 -HSE Manage in-house bank accounts for subsidiaries (Manage House Bank and Bank Account) 2.00,18,Request will be received via email to the approver.,MS Outlook (Application)
Review Bank Master request,9.7.3.1 -MSTR Manage in-house bank accounts for subsidiaries (Manage Bank Master) 2.00,35,Treasurer receives email notification from MDM team to review request for creation or update of bank master,MS Outlook (Application)
Review bank reconcilation,"9.7.3.7 Provide account statements for in-house bank accounts (Electronic Bank Statement (EBS), Bank Reconciliation, and Projection) 1.00",12,Perform bank reconciliation review,BlackLine BlackLine: (Financial Closing) (Application)
Review Bank User Profile Authorization Matrix,9.7.3.1 -MSTR Manage in-house bank accounts for subsidiaries (Manage Bank Master) 2.00,41,"The Corporate Controller, Director Finance Shared Services and Treasurer reviews the ABN, BMG, TIS and HSBC Bank Matrix while the BU Controller reviews the ASMJ and ASMK local Bank User Profile Authorization Matrix to ensure there is proper segregation of duties, and in accordance with Board Resolution/ GAM and signs off as evidence of review.",
Review BIA access request,13.8.1.2 Provide BIA access 1.00,11,The BIA report owner reviews the access and ask the Global Process Owner if access can be given. Email approval is needed from the Global Process Owner.,
Review BIA report,13.8.7B Create data models (Release BIA report) 1.00,22,"The BIA report will get reviewed if it meets the BIA governance:
Is the PBI template used
Title page, About page with clear objective formulated
One message per report page
Abbreviations fully spelled
Glossary page if applicable
Clear visuals, font sizes etc.
Check the data sources being used
Check the Data catalog
Furthermore, some administration work needs to be done:
Add BIA report to the Report Catalog/ as a PBI document in Adonis.
Link BIA report to APQC process in ASM business model
Check the COE checklist
Make sure Global Process Owner approval (screenshot) is added in the COE Checklist
COE checklist uploaded in the BIA SharePoint folder
Send email for final approval to BIA sponsor and IT Business Lead to arrange access and publications to the Consumers.",Power BI (Microsoft) (Application)
Review BOM (SME),2.5.3.2 -iPLM Manufacturing Preparation Request 1.00,21,,SAP IPS iPLM Manufacturing Preparation ticket workflow (Application)
Review booked hours,5.3.2.6E Time Booking 2.00,4,"Key Activities:
Judge if split out hours need correction",SAP CAT2: Time Sheet: Maintain Times (Application)
Review buffer proposal,4.1.3.5 Generate Constrained Plan (DDMRP Evaluation and Calculation) 2.00,4,,Fiori F2706: Manage Buffer Levels for Production Planner (Application)
Review Build Plan Date Change Record,4.1.3.1 -FCST Create Unconstrained Plan 3.00,2,,SAP ZPP_PIR_DATE_CHANGE: Demand Requirement Date Update (Application)
"Review business landscape, outlook, penetration, and market share",3.5.2.2 R&C Develop sales/key account plan 1.00,7,,
Review business volume,4.2.3.4F Supplier Rebate Management 2.00,2,,Fiori WB2R_BUSVOL: Display Business Volume - Condition Contracts (Application)
Review by FSE booked hours,5.3.2.6E Time Booking 2.00,13,"Key Activities:
Judge booked time
Approve If without issue: Approve
Request correction from originator, If issues are observed
Reject: when hours are duplicate or an over-booking.
Attention: Rejection, blocks the originator to correct their input Correction is only possible after the reviewer resets their approval",SAP CATS_APPR_LITE: Approve Working Times (Application)
Review Calibration schedule,4.1.8.2C Create Calibration Plan and schedule 2.00,12,The Schedule Overview is monitored by the Calibration Coordinator,Fiori IP10: Schedule Maintenance Plan (Application)
Review capacity,4.3.2.6 R&C Assess production performance (Production Mtg) 1.00,11,Review capacity per location based on IE (industrial engineering) input. Based on build plan and capacity plan.,
Review Capacity Requirements,4.3.1.3 -PPDS Lean PP Generate detailed schedule (Production Planning and Detailed Scheduling) 2.00,8,"Key actvities:
Review Capacity Requirement
App: Manage Work Center Capacity",Fiori CM01: Cap. planning. work center load (Application)
Review Capex budget proposals,9.4.1.2 Develop and approve capital expenditure plans and budgets 1.00,8,,
Review Capex budget proposals,9.4.1.2 Develop and approve capital expenditure plans and budgets 1.00,10,,
Review changes on opportunities,4.1.2.3 -EQ Develop demand consensus forecast - Weekly Process 1.00,7,,"Kinaxis - Collaboration feature (Application),
Kinaxis ASM_IE_Capacity: Workbook ASM IE Capacity (Application)"
Review CO line items reports [Display line items-Cost Accounting / Display actual cost doc / Display cost line items - cost centers - Actual],9.1.3.2 Measure cost drivers 1.00,20,"GL accountant will review the allocation result in the CO line items
If the allocation is correct, they would measure the cost drivers by executing different cost management reports",SAP KE24: Display Actual line items: 0010 - Account-based (Application)
Review Completed & Sign-Off,9.7.3.1 -MSTR Manage in-house bank accounts for subsidiaries (Manage Bank Master) 2.00,42,"The Corporate Controller and Director Finance Shared Services reviews the ABN, BMG, TIS and HSBC Bank Matrix while the BU Controller reviews the ASMJ and ASMK local Bank User Profile Authorization Matrix to ensure there is proper segregation of duties, and in accordance with Board Resolution/ GAM and signs off as evidence of review.",
Review configuration of opportunity,4.1.2.4A Develop available to promise Build Plan 1.00,17,,
Review configured useful life per asset class type,9.3.3.6 Calculate and record depreciation expense 1.00,35,Head of Accounting reviews the existing configured useful life per asset class type in SAP with the depreciation rates defined in the relevant accounting policies to ensure the rates are configured in accordance with the policy.,
Review confirmation to ensure GTC Software engineers do not have access to hardware sub-folder,11.2.2.6B R&C Monitor and test regulatory compliance position and existing controls (EPI Export) 1.00,25,To prevent unauthorized access to EPI export controlled technology (3E001),
Review consolidated group financial reports,9.3.4.8C Perform legal and management consolidation (Consolidation & Reporting) 1.00,15,,
Review consolidated group financial reports,9.3.4.8C Perform legal and management consolidation (Consolidation & Reporting) 1.00,17,,
Review contract,4.2.3.3.1 -CONTRACT Supplier Contracts Approval 1.00,15,"Key activities:
Review contract details
Provide motivation and alternative in case rejecting approva",
Review contract,4.2.3.3.1 -CONTRACT Supplier Contracts Approval 1.00,38,"Key activities:
Review contract details
Provide motivation and alternative in case rejecting approva",
Review contract,4.2.3.3.1 -CONTRACT Supplier Contracts Approval 1.00,26,"Key activities:
Review contract details
Provide motivation and alternative in case rejecting approva",
Review contract,4.2.3.3.1 -CONTRACT Supplier Contracts Approval 1.00,40,"Key activities:
Review contract details
Provide motivation and alternative in case rejecting approva",
Review contract,4.2.3.3.1 -CONTRACT Supplier Contracts Approval 1.00,5,"Key activities:
Review contract details
Provide motivation and alternative in case rejecting approval",
Review contract,4.2.3.3.1 -CONTRACT Supplier Contracts Approval 1.00,18,"Key activities:
Review contract details
Provide motivation and alternative in case rejecting approva",
Review contract,4.2.3.3.1 -CONTRACT Supplier Contracts Approval 1.00,21,"Key activities:
Review contract details
Provide motivation and alternative in case rejecting approva",
Review contract,4.2.3.3 -CONTRACT Negotiate and establish contracts 1.00,38,,
Review contract/ scheduling agreement,4.2.3.3 -SCHEDULING Negotiate and establish contracts 2.00,27,,"Fiori F2179: Manage Scheduling Agreement for Purchaser (Application),
Fiori ME33L: Display Scheduling Agreement (Application),
Fiori ME38: Manage SA Delivery Schedule for Purchaser (Application)"
Review Cost Center Reports [Cost Center Plan / Actual / Cost Center Actual / Cost Center Plan / Actual YTD],9.1.3.2 Measure cost drivers 1.00,26,"GL accountant will review the allocation result in the cost center report.
If the allocation is correct, they would measure the cost drivers by executing different cost management reports","Fiori F0963: Cost Centers - Actual for Cost Accountant - Overhead (Application),
SAP S_ALR_87013611: Cost Centers: Actual/Plan/Variance (Application)"
Review cost drivers to determine allocation result [Allocation Result / Allocation Flow],9.1.3.2 Measure cost drivers 1.00,18,GL accountant will review the allocation result.,"Fiori F3338: Manage Allocations for Cost Accountant - Overhead (Application),
Fiori F4363: Allocation Results for Cost Accountant - Overhead (Application)"
Review cost of sales variance reports,9.1.2.3 Perform cost of sales analysis 1.00,13,,SAP AFO: (Analytics For Office) org (Application)
Review cost of sales variance reports,9.1.2.3 Perform cost of sales analysis 1.00,11,,SAP AFO: (Analytics For Office) org (Application)
Review cost simulation,9.1.2.4 -EXT MAKE Perform product costing (Existing Make Part) 1.00,25,,MS PowerApp (Microsoft) (Application)
Review CTSI Invoice Spool List,9.6.1.3 -CTSI Audit invoices and key data in AP system (CTSI) 1.00,12,,
Review Customer response,9.2.2.2 -REBATE Generate customer billing data (Customer Rebate) 2.00,11,Review if customer accepts or rejects rebates,
Review Customer response,3.5.3.13 Submit/Present bid/Proposal/Quote to customer 2.00,19,,
Review customers response via email,5.3.3.5 -PD Complete Service Order ZMPD: PaiD 1.00,35,,Email (Application)
Review cycle time report with Manufacturing team,4.1.1.5 -SP Define Capacities 2.00,11,,
Review data compared to Anaplan data,9.1.2.4 -ACVT RATE Perform product costing (Maintain Activity Rate) 1.00,30,Review against budget data in excel file downloaded from Anaplan by Business Control Director,
Review data in Finance tab,4.2.5.1 Monitor Manage supplier information 2.00,42,via SAP VMR workflow approval,SAP ZMM_VEND_MGMT: Vendor Master Management (Application)
Review demand forecast plan with other functions (current quarter +5),4.1.2.3 -EQ Develop demand consensus forecast - Monthly Process 1.00,2,,
Review documentation retained in Sharepoint,9.3.3.6 Calculate and record depreciation expense 1.00,39,,
Review down payment request,9.6.1.3 -DWNPMT Audit invoices and key data in AP system (Early/ Down Payment) 1.00,35,,
Review down payment request,9.6.1.3 -DWNPMT Audit invoices and key data in AP system (Early/ Down Payment) 1.00,25,,MS PowerApp (Microsoft) (Application)
Review E&O analysis report and provision,9.1.2.1 -QTR E&O Perform inventory accounting (Quarterly E&O) 1.00,24,Review E&O analysis report and provision (Excess & Obsolescence) by Business Analyst,MS Outlook (Application)
Review E&O true-up calculations report,9.1.2.1 -QTR E&O Perform inventory accounting (Quarterly E&O) 1.00,16,Review E&O true-up report with Business Control Manager,MS Outlook (Application)
Review E&O true-up report,9.1.2.1 -QTR E&O Perform inventory accounting (Quarterly E&O) 1.00,20,Review E&O true-up report with GOPS Controller,MS Outlook (Application)
Review early payment request,9.6.1.3 -DWNPMT Audit invoices and key data in AP system (Early/ Down Payment) 1.00,18,,MS PowerApp (Microsoft) (Application)
Review early payment request,9.6.1.3 -DWNPMT Audit invoices and key data in AP system (Early/ Down Payment) 1.00,12,,MS PowerApp (Microsoft) (Application)
Review Failure analysis report,"13.3.3.1C -FA Assess potential impact (Failure Analysis QN, Performing FA) 1.00",7,Review Failure analysis report,Fiori QM03: Display Quality Notification (Application)
Review FG listing to ensure adequate provision/ impairment,9.1.2.1 -QTR FG Perform inventory accounting (Quarterly FG Listing) 1.00,5,"SU1 Business Controller Analyst reviews FG obsolescence/impairment based on 1 or 2 (second month of quarter)
1. aging over 12 months OR
2. risk significant or high",MS Outlook (Application)
Review FG provision,9.1.2.1 -QTR FG Perform inventory accounting (Quarterly FG Listing) 1.00,17,FG provision is prepared and reviewed by SU1,MS Outlook (Application)
Review FG Provision to ensure adequate provision/ impairment,9.1.2.1 -QTR FG Perform inventory accounting (Quarterly FG Listing) 1.00,13,"SU1 Business Control Analyst inputs comments to propose for FG provision, send for SU1 Business Controller review, and then sent to BU Business Control.
BU Business Control. send back the feedback if need to take provision.",MS Outlook (Application)
Review final regional sales presentation deck,3.5.2.3 R&C Manage sales/key account plan 1.00,13,,
Review final stock revaluation report,9.1.2.4 -EXT MAKE Perform product costing (Existing Make Part) 1.00,32,,MS Outlook (Application)
Review final stock revaluation report,9.1.2.4 -EXT BUY Perform product costing (Existing Buy Part) 1.00,68,,MS Outlook (Application)
Review final stock revaluation report,9.1.2.4 -EXT SP Perform product costing (Existing Spare Part) 1.00,31,,MS Outlook (Application)
Review final stock revaluation report,9.1.2.4 -EXT MAKE Perform product costing (Existing Make Part) 1.00,28,,MS Outlook (Application)
Review final stock revaluation report,9.1.2.4 -EXT SP Perform product costing (Existing Spare Part) 1.00,27,,MS Outlook (Application)
Review final stock revaluation report,9.1.2.4 -EXT BUY Perform product costing (Existing Buy Part) 1.00,64,,MS Outlook (Application)
Review fixed assets reconciliation,9.3.3.7 Reconcile fixed-asset ledger 1.00,6,,BlackLine BlackLine: (Financial Closing) (Application)
Review for approval,9.3.3.6 Calculate and record depreciation expense 1.00,6,,MS Outlook (Application)
Review for final approval,4.2.5.1 Monitor Manage supplier information 2.00,35,,SAP ZMM_VEND_MGMT: Vendor Master Management (Application)
Review for remaining uncleared line items in ICRRB GL Account 1539XX and 3119XX,9.3.2.2 -OIM Process journal entries (Open Item Clearing & ICRRB) 1.00,7,,"Fiori F-03: Clear G/L Accounts (Application),
Fiori FAGLL03: Display G/L Accounts Line Items - For Ledger (Application),
Fiori FAGLL03H: Display G/L Accounts - Line Items Browser (Application),
Fiori FBL3N: Display G/L Account Line Items (Application)"
Review for Second Source approval,4.4.2.2E First Article Inspection (First Article GR Inspection - Physical Verification) 1.00,31,,
