Task Name,Model Associated,Order,Description,Tcode Associated
Create/ Edit Return Sales Order,6.2.4.1 -SP Process returns (ARM) 1.00,33,"ZRE1, create with reference to sales order for CKM
ZRE2, create with reference to invoice
ZRE4, create without reference
R01: Defective Parts (including CKM defective component)
R05: CKM Return (including dirty/ defective kit and dirty component (e.g. chamber))- which will trigger return traveler form","Fiori VA01: Create Credit Memo Requests - W/o Preceding Document. Create Customer Return Without Reference - VA01. Create Debit Memo Requests - W/o Preceding Document. Create Sales Orders. Create Sales Orders - Intercompany. Create Sales Orders (Application),
Fiori VA02: Change Credit Memo Request. Change Debit Memo Request. Change Sales Order Without Charge. Change Sales Orders. Change Sales Orders - VA02 (Application)"
Create/ Update contract (Object),4.2.3.3 -CONTRACT Negotiate and establish contracts 1.00,30,,Fiori ME31K: Create Purchase Contract for Purchaser (Application)
Create/ update GSNIA (Goods Scrap Notification Inventory Adjustment),4.4.3.5 -GSNIA Track Inventory Accuracy (Goods Scrap Notification Inventory Adjustment) 1.00,13,"GSNIA: Goods Scrap Notification Inventory Adjustment
Key activities:
Create GSNIA listing materials and qualities to be adjusted or scrapped
Enter WBS number for cost allocation
(If request is originating from Cycle Count / adjustment WBS is not required
cost will be allocated to GL scrap account)",SAP ZMM_GSNIA: Global GSN & IA (Application)
Create/ update Purchase Requisition,4.2.4.1 Process/Review requisitions 1.00,6,"Identify the desired activities and add these to one or multiple purchase requisitions.
Examples:
Indirect Materials, or
Rework:
Rework by supplier at ASM site (needs quotation)
Rework by supplier - not original supplier (e.g. paint rework)
Rework by supplier","Fiori F2424: Monitor Purchase Requisition Items for Purchaser (Application),
Fiori ME51N: Create Purchase Requisition - Advanced (Application)"
Create/Adjust firm orders (Manual Override of recommended PMCD),4.1.2.4A Develop available to promise Build Plan 1.00,23,PMCD: Planned Manufacturing Completion Date,
Create/Change Inspection Plan,4.1.8.2A Inspection Plan 2.00,8,Inspection plan header data,"Fiori QP01: Create Inspection Plan for Quality Planner (Application),
Fiori QP02: Change Inspection Plan for Quality Planner (Application),
Fiori QP03: Display Inspection Plan (Application)"
Create/Change Production Version,4.1.1.7C Define Production Process (Production Version) 3.00,5,"Change:
Assigned Routing data
Change Assigned BOM
Change Production Version Status","Fiori C223: Manage Production Versions. Manage Production Versions - C223 (Application),
Fiori F2568: Manage Production Versions for Production Engineer - Discrete Manufacturing (Application)"
Create/Change Routing,4.1.1.7B Define Production Process (Routing) 3.00,15,"Routing Header data
Operation data
Allocate Components to Operation
Assign PRT to Operation
Assign E-PRT to Operation
Assign Reference Operation Set (Master Inspection Characteristics created by Quality) to Quality Inspection step as needed.
Determine reason for update (New or Existing Parts?)","Fiori CA01: Create Routing for Production Engineer - Discrete Manufacturing (Application),
Fiori CA02: Change Routing for Production Engineer - Discrete Manufacturing (Application)"
Create/Edit Return Order or Credit Memo Request,3.5.4.5A Enter Sales Orders into system 1.00,60,"Execute per work instruction (to be Written), will describe what needs to be entered in sales order per sales scenario.
Based on the original Sales Order as input
Order type ZRE: Equipment Return Order, Eval Tool Return Order
Return Order created with reference to original equipment sales order.
What to be entered on all sales orders
1.Customer (check Sold-to, Ship-to party)
2.Material (Notified by OFE workflow)
3.WBS (Notified by PM team via email)
4.Customer Purchase Order No
5.Order Quantity
6.Order Reason
7.Price (zero credit value)
8.Billing plan
9.Plant
10.Item Cat (billing plan relevant item lines)
Order type ZCR: Credit Memo Request
Credit Memo Request created with reference to original equipment invoice.
What to be entered on all sales orders
1.Customer (check Sold-to, Ship-to party)
2.Material (Notified by OFE workflow)
3.WBS (Notified by PM team via email)
4.Customer Purchase Order No
5.Order Quantity
6.Order Reason
7.Price (credit memo value)
8.Billing plan
9.Plant
10.Item Cat (billing plan relevant item lines)
Order type CR
Credit Memo Request created with reference to original invoice, then information will be copied from invoice to credit memo.","Fiori VA01: Create Credit Memo Requests - W/o Preceding Document. Create Customer Return Without Reference - VA01. Create Debit Memo Requests - W/o Preceding Document. Create Sales Orders. Create Sales Orders - Intercompany. Create Sales Orders (Application),
Fiori VA02: Change Credit Memo Request. Change Debit Memo Request. Change Sales Order Without Charge. Change Sales Orders. Change Sales Orders - VA02 (Application)"
Create/Edit Sales order,3.5.4.5A Enter Sales Orders into system 1.00,43,"Execute per work instruction (to be Written), will describe what needs to be entered in sales order per sales scenario.
2024-08-05 Sue Anne
Order type ZOR5: Standard Equipment Order (preship/partial), Equipment Order with Credit/Package deal, Eval (FOC) Order, Eval Turn Order, RFK Order, Refurbishment Order, Demo Wafer Order, Replacement Order
[Sophie - can we specify per Order Reason?]
What to be entered on all sales orders
1.Customer (check Sold-to, Ship-to party)
2.Material VC (Notified by OFE workflow)
2.Material NONVC (Notified by OFE workflow) -- the same
3.WBS (Notified by PM team via email)
3.WBS (Notified by OFE workflow)
4.Customer Purchase Order No
5.Order Quantity
6.Order Reason
7.Price (customer PO price, credit ID/value, package ID, etc.)
8.Billing plan
9.HL link
10.Plant
11.Item Cat (billing plan relevant item lines)
12.Usage Field (preship/partial ship)","Fiori VA01: Create Credit Memo Requests - W/o Preceding Document. Create Customer Return Without Reference - VA01. Create Debit Memo Requests - W/o Preceding Document. Create Sales Orders. Create Sales Orders - Intercompany. Create Sales Orders (Application),
Fiori VA02: Change Credit Memo Request. Change Debit Memo Request. Change Sales Order Without Charge. Change Sales Orders. Change Sales Orders - VA02 (Application)"
Create/Edit Sales order,3.5.4.5A Enter Sales Orders into system 1.00,71,"Execute per work instruction (to be Written)
will describe what needs to be entered in sales order per sales scenario.
2024-07-30 Eva -
This step covers transactional spares and standalone FOC.
What to be entered on all sales orders
1.Customer (sold-to/ ship-to party)
2.Customer Purchase Order No
3.Order Reason (identify BU3 revenue streams or reasons for FOC)
4.Requested delivery date
5.Material (ASM material/ customer material if needed)
6.Order quantity
7.Delivery priority
8.Delivery plant/ storage location
9.Price (customer PO price, credit ID/value, package ID, etc.)","Fiori VA01: Create Credit Memo Requests - W/o Preceding Document. Create Customer Return Without Reference - VA01. Create Debit Memo Requests - W/o Preceding Document. Create Sales Orders. Create Sales Orders - Intercompany. Create Sales Orders (Application),
Fiori VA02: Change Credit Memo Request. Change Debit Memo Request. Change Sales Order Without Charge. Change Sales Orders. Change Sales Orders - VA02 (Application)"
Create/Edit Spare Sales order (Consignment Fill Up ZKB),3.5.4.5A Enter Sales Orders into system 1.00,2,"What to be entered on all sales orders
1.Customer (sold-to/ ship-to party)
2.Customer Purchase Order No
4.Requested delivery date
5.Material (ASM material/ customer material if needed)
6.Order quantity
7.Delivery priority
8.Delivery plant/ storage location","Fiori VA01: Create Credit Memo Requests - W/o Preceding Document. Create Customer Return Without Reference - VA01. Create Debit Memo Requests - W/o Preceding Document. Create Sales Orders. Create Sales Orders - Intercompany. Create Sales Orders (Application),
Fiori VA02: Change Credit Memo Request. Change Debit Memo Request. Change Sales Order Without Charge. Change Sales Orders. Change Sales Orders - VA02 (Application)"
Create/Edit Value/Quantity Contract document (Child),3.5.4.5B Enter sales contracts into system 1.00,20,"each child contract represents one deal, currently it's for CKM L0 (TW Intrepid)","Fiori VA41: Create Contract. Create Sales Contracts (Application),
Fiori VA42: Change Contract (Application),
Fiori VA43: Display Contract - VA43 (Application)"
Create/Edit Value/Quantity Contract document (Parent),3.5.4.5B Enter sales contracts into system 1.00,11,"Value contract =Contract value will be equal to planned revenue of quotation
Quantity contract = planned quantity from quotation","Fiori VA41: Create Contract. Create Sales Contracts (Application),
Fiori VA42: Change Contract (Application),
Fiori VA43: Display Contract - VA43 (Application),
Fiori WSV2: Create Assortment Module - Value Contract: (Application)"
Create/extend/update PIR,4.2.3.4B Manage Purchase Info Record 2.00,15,,"Fiori ME12: Change Purchasing Info Record for Purchaser (Application),
Fiori ME13: Display Purchasing Info Record (Application),
SAP ZMMR_PIR: Purchase Info Record Mass Update (Application)"
Create/extend/update PIR (Mass),4.2.3.4B Manage Purchase Info Record 2.00,19,,"Fiori ME12: Change Purchasing Info Record for Purchaser (Application),
Fiori ME13: Display Purchasing Info Record (Application),
SAP ZMMR_PIR: Purchase Info Record Mass Update (Application)"
Create/Release/Update Rebate Condition Contract,9.2.2.2 -REBATE Generate customer billing data (Customer Rebate) 2.00,3,,Fiori WCOCO: Maintain Contract - Condition Contracts for Contract Manager - Settlement Management (Application)
Create/Submit MDM request to extend BP to Distribution Channel 02,6.3.4.1D Manage Functional Location 1.00,13,"Key activities:
Create and submit MDM request",HaloITSM MDM (Master Data Management) (Application)
Create/update Business Partner information,3.5.2.5 Manage Customer Master Data 1.00,11,,Fiori BP: Brokers. Define Business Partner. Maintain Business Partner (Application)
Create/update and Save Purchase Order,4.2.4.4A Create/Distribute Purchase Orders 2.00,52,,"Fiori ME21N: Create Purchase Order. Create Purchase Order - Advanced (Application),
Fiori ME22N: Change Purchase Order. Change Purchase Order - Advanced (Application),
SAP ZME59N: Automatic Creation of Purchase Order (Application)"
Create/update Business Partner information,4.2.5.1 Monitor Manage supplier information 2.00,49,Create/update business partner information in SAP Tcode,SAP ZMM_VEND_MGMT: Vendor Master Management (Application)
Create/update condition contract,4.2.3.4F Supplier Rebate Management 2.00,15,Condition contracts can grant rebate payments to a vendor based on different criteria.,Fiori WCOCO: Maintain Contract - Condition Contracts for Contract Manager - Settlement Management (Application)
Create/Update Cost Element Groups,9.3.2.1 Maintain chart of accounts 1.00,19,,"Fiori F5373: Manage Cost Element Groups for Cost Accountant - Overhead (Application),
Fiori KAH2: Edit Cost Element Groups for Cost Accountant - Overhead (Application)"
Create/Update Financial Statement Versions,9.3.2.1 Maintain chart of accounts 1.00,20,,"Fiori F4965: Migrate to Global Hierarchies for General Ledger Accountant (Application),
Fiori OB58: Maintain Financial Statement Version, Manage Financial Statement Versions for General Ledger Accountant (Application)"
Create/Update GL Account,9.3.2.1 Maintain chart of accounts 1.00,18,,"Fiori F0763A: Manage Chart of Accounts for General Ledger Accountant (Application),
Fiori FS00: Edit G/L Account - Central View (Application),
Fiori FS02: Manage G/L Account Master Data for General Ledger Accountant (Application),
Fiori FSP0: Edit G/L Account - Chart of Accounts View (Application)"
Create/Update New Product Hierarchy,2.1.4.6 Manage product/material classification (Create New Product Hierarchy) 1.00,23,Create/Update New Product Hierarchy in Production system.,
Create/update Purchasing Categories,4.2.5.2A Prepare/Analyze procurement and vendor performance 2.00,18,,Fiori F0337: Manage Purchase Categories for Strategic Buyer (Application)
Create/update question library,4.2.5.2A Prepare/Analyze procurement and vendor performance 2.00,5,This action is decided to be performed outside,"Fiori /SRMSMC/WDA_QLB_OVP_MAIN (): Manage Questions - Evaluation (Application),
Fiori F2194: Manage Questionnaire for Strategic Buyer (Application)"
Create/update quota arrangement,4.2.3.4E Manage Quota Arrangement 1.00,10,"Prerequisite for maintaining Quota Arrangement
- Materials
- Supplier
- Quota Split
- Validity Date","Fiori F1877: Manage Quota Arrangements for Purchaser (Application),
Fiori MEQ1: Maintain Quota Arrangement (Application)"
Creation of Supplier Change Request (SCR),13.3.3.1 -SCR Assess potential impact (Supplier change request) 1.00,2,"Received QN Type ZS-ASM SCR
Supplier is responsible for providing 12-month notification in advance prior to any change to the part. This is to give ASM ample time and opportunity to review the proposed change and accommodate the needed change into our tools without disruption to supply continuity.
The supplier is responsible to provide all related documents prior to the change needed and attach them into the SCR for submission.
Reasons for raising SCR
□ design change
□ supply chain change
□ change in (raw/additional) materials
□ change in cleaning/packaging
□ change in software
□ change in manufacturing location, equipment, process, flow or sequence of events.
For end of life (EOL) components, use 127 Form 3.",
Cross company credit utilization FI Posting,9.3.2.4 -RAR Process period end adjustments (RAR) 1.00,31,,SAP ZFIT_FARR_CROSS_COMP_POSTING (Application)
Customize configured Software instance,3.5.4.4C OFE ER Phase: Final Documentation [50] 1.00,32,,SAP IPS OFE Workflow (Order Fullment Equipment Engineering Record) (Inteligent Process System -Workflow engine by LeverX-) (Application)
De-activate Functional Location,6.3.4.1D Manage Functional Location 1.00,22,"Key activities:
De-activate the wrong or no longer used Functional Location",Fiori IL02: Change Functional Location for Technical Officer - Armed Forces (Application)
"De-activate Functional Location in FSM, Enablon",6.3.4.1D Manage Functional Location 1.00,23,Automated task,SAP FSM: Field Service Management (Application)
De-activate U-BOM (Status: 02) (Universal Bill Of Material),2.5.1.2.4 Review Production Order 1.00,11,"Key Action(s):
Change BOM status to In-active (02)",
Deallocate affected orders,4.3.1.4 Reschedule Production Orders 2.00,39,"Update the operation status and deallocate capacity.
T-code: /SAPAPO/CDPS0
App: Advanced Scheduling Board","Fiori F5460: Advanced Scheduling Board (Application),
SAP /SAPAPO/CDPS0: DPS Variable View (Application)"
Decide and Approve delivery of high value cost parts,5.3.2.6 -Need Field Service parts delivery 1.00,12,"Key Activities:
Service Manager (or Above level depend on cost) to make judgement if approve or reject high cost part request.
If Reject, Add reason for rejection
.",
Decide by Marketing Team,3.5.4.7B Process back orders and updates (OFE Change Approval Ticket C Market Team Decision) 1.00,7,,SAP IPS OFE Workflow (Order Fullment Equipment Engineering Record) (Inteligent Process System -Workflow engine by LeverX-) (Application)
Decide disposition,13.3.3.3.2C Material purge process 1.00,16,"The disposition of the controlled stocks must be decided jointly by the Supplier Quality Engineer, Product Support, and Manufacturing Engineer.
Disposition options:
Use as is
Scrap
RTV",
Decide if packing list update is needed,"4.4.3.4 Pick, pack, and ship product for delivery 1.00",18,,
Decide if to propose extension of near expiring contracts,4.2.3.3 -CONTRACT Negotiate and establish contracts 1.00,20,"Key activities:
Per contacts indicated to expire establish the,Need of extension e.g by contacting known users
Form and extension strategy (e.g: time period, size of grap-down stock extension, conditions to change and perks to pursue) Contact the supplier to prepare the extension",
Decide Make / Buy,4.1.1.7A Define Production Process (MBOM) 1.00,6,,Fiori MM02: Change Material (Application)
Decide on additional actions,4.2.1.5 R&C Analyze organization’s spend profile 1.00,19,,
"Decide on correction or rejection, inform FSE",5.3.2.6E Time Booking 2.00,9,"Key activities:
Either:
Request corrections from originator
Reject hours and inform originator on reason e.g.: hours are duplicate or there is an over-booking.
Attention: Rejection, blocks the originator to correct their input Correction is only possible after the reviewer resets their approval",SAP CATS_APPR_LITE: Approve Working Times (Application)
Decide on other PO matters,13.3.3.3.2C Material purge process 1.00,18,"The team must address the below matters.
Decision of release of Open PO’s that were blocked
Decision of release of new PO’s to the supplier",
Decide to accept or reject Failure Analysis request,13.3.3.1A -FA Assess potential impact (Failure Analysis QN Intake) 1.00,24,"The Case Owner is the designated owner of the FA case and the single point of ownership and accountability throughout the FA Process; this individual is responsible for the following:
· Review and disposition (Approve or Reject) all FA requests designated by Product Type within 2 calendar days.
· Assign a capable Technical Case Owner per case if different from the person approving the FA case. This can be completed in the FA case record.
· If the FA case is approved, sets the following in the FA case record:
o Priority (High or Low/Standard)
o FA Type (Internal, Supplier or Internal Review/Supplier)
· Is responsible for creating an FA Plan that will be used to determine root cause(s). The structure of this plan must include following Effective Problem Solving (EPS), particularly the “n-whys” methodology:
o Defining a clear Problem Statement
o Develop Root Cause Hypotheses
o Define Containment where applicable
o Determine what data should be collected and testing performed to validate Root Cause Hypotheses
· For Internal Review/Supplier FAs, the Case Owner is responsible for reviewing the part(s) upon arrival at ASM
· For Internal FAs the Case Owner is responsible for generating the FA data/report.
· Complete the Failure Analysis and create a final FA Report for the Customer (or internal stakeholders) that summarizes the FA findings and include:
o A clear Problem Statement
o Root Cause Hypotheses for failure
o Data,, and testing performed, which must validate or disprove the Root Cause Hypotheses
o Root Cause(s)
o Define Containment where applicable
o Identify Corrective and Preventive action plans with ECDs and final completion schedule to enable measurement of Performance Against Schedule.
· Deliver the FA Report to the Customer or internal stakeholder(s)
· Documents Customer or internal stakeholder Acceptance
· Shares all required reports and communication with stakeholders within ASM
· Close the FA with Root Cause(s) closure as well as Corrective and Preventive action plans to schedule",Fiori QM02: Change Quality Notification for Quality Engineer (Application)
Decide to use as is with Waiver,13.3.3.3.2D QN use as is follow up 1.00,13,,Fiori MIGO: Goods Movement. Post Goods Movement (Application)
Decrease credit limit,9.2.1.5 Review Existing Accounts (Process Credit Limit for Customer) 1.00,38,Decrease credit limit at BP Master (customer) post analysis and approval obtained,
Define corrections,4.1.5.1 -SP Maintain Master data 2.00,5,,
Define dimensions and measures,13.8.7A Create data models (creation BIA report) 1.00,4,Update the Dataset Catalog register (concept),
Define individual supply chain initiatives needed,4.2.2.1 R&C Develop sourcing and category management strategies 1.00,14,,
Define Loading Thresholds,4.1.1.5 -SP Define Capacities 2.00,5,,
Define Policy alignment requirement,11.2.2.2 Identify applicable regulatory requirements 1.00,8,"In case of gaps, define which level (local, global) and which policy needs to be adapted.",
Define problem and target statement,13.3.3.3 Identify root cause(s) (8D Problem solving) 1.00,12,"- Problem Statement: A precise/concise statement of; what, when, where, extent, impact (why it is a problem)
- Target Statement: Should be in the form of “From what (current status) to what (desired objective) by when (specific date)",
Define problem statement,13.8.7A Create data models (creation BIA report) 1.00,3,What is the opportunity and business value?,
Define short-/long-term risks & actions in Supplier Risk Update file,4.2.2.3 R&C Critical & constrained parts 1.00,4,"The supplier risk update includes:
- mapping of all parts to products
- short- and long term risks
- actions
- action owner
- due date
- action status",
Define the constraint usage for L0/L1 material,4.1.1.5 -SP Define Capacities 2.00,4,,
Define the data needed,13.8.7A Create data models (creation BIA report) 1.00,20,"This includes defining the data from the Data Source and any transformations needed to use the data for analysis in the BIA Dataset.
The Power User asks in the data request the Data Architect to determine if there are existing datasets available that can be used, or if a new Dataset needs to be created. The Data Architect will work with Data Engineer to extract new datasets if needed.",
Delete asset,9.3.3.2 Maintain fixed-asset master data files 1.00,17,For wrongly created assets,"Fiori AS06: Delete Asset for Asset Accountant (Application),
Fiori AW01N: Asset Values for Asset Accountant (Application)"
Delete contract,4.2.3.3 -CONTRACT Negotiate and establish contracts 1.00,33,,"Fiori F1600A: Manage Purchase Contracts (Version 2) for Purchaser (Application),
Fiori ME32K: Change Purchase Contract (Application)"
Delete cost estimate,9.1.2.4 -EXT BUY Perform product costing (Existing Buy Part) 1.00,11,"Delete cost estimate in material master based on material/ part number indicated in RSP PowerApp.
This step is required only if current standard cost is updated in the same month of the cost estimate.",Fiori CKR1: Reorganize Cost Estimates for Cost Accountant - Inventory (Application)
Delete MIC,4.1.8.1A Master Inspection Characteristic 1.00,2,Delete MIC,Fiori QS25: Delete Master Inspection Characteristic for Quality Planner (Application)
Delete PDS (Production Data Structure),4.1.1.7C Define Production Process (Production Version) 3.00,21,,Fiori /SAPAPO/CULL_RTO_DEL: Delete Production Data Structures for Production Planner - Advanced Planning (Application)
Delete Production Order,4.3.1.2 Generate line level plan (Prod.Ord. create and modify) 2.00,8,,"Fiori COHV: Mass Processing Production Orders for Production Supervisor - Discrete Manufacturing (Application),
SAP ZPB003: Mass change production order header (Application)"
Delete Production Version,4.1.1.7C Define Production Process (Production Version) 3.00,17,,"Fiori C223: Manage Production Versions. Manage Production Versions - C223 (Application),
Fiori F2568: Manage Production Versions for Production Engineer - Discrete Manufacturing (Application)"
Delete Purchase Order,4.2.4.4A Create/Distribute Purchase Orders 2.00,23,,Fiori ME22N: Change Purchase Order. Change Purchase Order - Advanced (Application)
Delete Purchase Requisitons,4.2.4.2 Approve requisitions 1.00,12,,Fiori ME52N: Change Purchase Requisition - DEPRECATED (Application)
Delete scheduling agreement,4.2.3.3 -SCHEDULING Negotiate and establish contracts 2.00,21,Set deletion flag,Fiori ME32L: Change Scheduling Agreement (Application)
Delete Service Entry Sheet,4.2.4.4C Approve Service Entry Sheet 2.00,9,,Fiori F2027: Manage Service Entry Sheets - Lean Services for Employee - Procurement (Application)
Deploy BIA report to Consumers,13.8.7B Create data models (Release BIA report) 1.00,11,The report owner who in most cases is also the Power User is responsible for deploying the BIA report to the Consumers.,Power BI (Microsoft) (Application)
Deregister Equipment,4.3.3.1 Calibrate Test Equipment (Internal) 1.00,10,Write off the equipment or trigger repair,Fiori QM01: Create Quality Notification for Quality Engineer (Application)
Describe reason for QN task rejection,13.3.3.3 Identify root cause(s) (8D Problem solving) 1.00,3,,Fiori QM02: Change Quality Notification for Quality Engineer (Application)
Describe reason for rejection,13.3.3.5 Close non-conformance 1.00,9,,Fiori QM02: Change Quality Notification for Quality Engineer (Application)
Describe reason for rejection,13.3.3.5 Close non-conformance 1.00,17,,
Detemine if parts are contaminated,6.2.4.1 -SP Process returns (ARM) 1.00,28,,
Deterime incident location,13.3.3.1B -FS Assess potential impact (Field Services QN wrong part return) 1.00,16,,
Determination of High Cost,3.5.4.5A Enter Sales Orders into system 1.00,13,,
Determine Activities needed,2.5.1.2.1 Setup MBOM 1.00,7,"Manufacturing Engineer is notified of the creation of a new MBOM
and decides how to process that.
Option depends on settings in the ticket (Plant#)
restructure MBOM
sourcing
both restructure and sourcing
no restructure or sourcing",SAP Web_UI: (User Interface) org (Application)
Determine ASM manufacturing entities involved,9.1.2.4 -ACVT RATE Perform product costing (Maintain Activity Rate) 1.00,6,,
Determine availability of replacement instance,13.3.3.1B -FS Assess potential impact (Field Services QN wrong part return) 1.00,20,,
Determine benefits of extension to Spares plant / FSM?,5.3.2.6F Initiate NC/ RMA Return 4.00,60,"Key activities:
Balance the expected frequence of repeat cases versus
the additional effort to permanently administrative effort to
maintain the material in spares plants",
