Task Name,Model Associated,Order,Description,Tcode Associated
Create Inspection lot,4.3.3.1 Calibrate Test Equipment (Internal) 1.00,3,,
Rectify errors noted,9.3.2.4 -YrEnd CarryFwd Process period end adjustments 1.00,4,To investigate why the carryforward balance does not reconcile between subledger (AP/AR/AA) and GL balances and rectify.,
Trigger scrap collection,4.4.3.5 -GSNIA Track Inventory Accuracy (Goods Scrap Notification Inventory Adjustment) 1.00,25,,
Abort any open approvals,"13.3.3.1E.2 SPDA(Short Ship Deviation-Type 1)GOPS 8200,3300,GSS 3118 Ariba supplier 1.00",14,,
Abort any open approvals,"13.3.3.1E.1 SPDA (Non short ship-Type 1)GOPS 8200,3300,GSS 3118 Ariba supplier 1.00",43,,
Acknowledge email,3.5.1.6 R&C Manage opportunity pipeline 1.00,10,,
Activate Equipment,6.3.4.1E Manage Equipment Master 1.00,3,"Key activities:
Manually Activate Equipment",Fiori IQ02: Change Material Serial Number (Application)
Activate QN,13.3.3.1 -FS Assess potential impact (Field Services QN) 1.00,29,,"Fiori QM03: Display Quality Notification (Application),
Fiori QM11: Display Quality Notifications - Worklist (Application)"
Activate/ Deactivate and Maintain spare part planning parameters in material,4.1.5.1 -SP Maintain Master data 2.00,43,Key action(s): Based on introduction or retirement Activate/ Deactivate and Maintain spare part planning parameters in material,"Fiori /SAPAPO/CURTO_SIMU: Display Production Data Structures for Production Planner - Advanced Planning (Application),
Fiori MM02: Change Material (Application)"
Add Cash Flow reporting rule,9.3.4.8A Perform legal and management consolidation (Preparatory Activity) 1.00,15,"Maintain Cash Flow Reporting rule Application
(FINCS_RRULE)",Fiori FINCS_RRULE: Define Reporting Rules (Application)
Add EPD workflow to include relevant stakeholders,13.3.3.1 -SCR Assess potential impact (Supplier change request) 1.00,14,Add EPD workflow to include relevant stakeholders who need to be consulted to give input for the suggested Supplier Change Request.,
Add Forecast BOM to Change Master,4.1.3.1 -FCST Create Unconstrained Plan 3.00,27,,Fiori CC02: Change Change Master (Application)
Add group structure,9.3.4.8A Perform legal and management consolidation (Preparatory Activity) 1.00,13,"Update or
create group structure in Manage Group Structure Application
(F3733)","Fiori F2918: Supplier Evaluation Weighting and Scoring for Strategic Buyer (Application),
Fiori F3733: Manage Consolidation Group Structure - Group View for Administrator - Group Reporting (Application)"
Add master data,9.3.4.8A Perform legal and management consolidation (Preparatory Activity) 1.00,14,"Define Master Data for Consolidation Fields Application
(F3007)",Fiori F3007: Define Master Data for Consolidation Fields for Administrator - Group Reporting (Application)
Add more information in QN,13.3.3.1 -IM Assess potential impact (Improvement-Manual QN) 1.00,7,,"Fiori QM02: Change Quality Notification for Quality Engineer (Application),
Fiori QM03: Display Quality Notification (Application)"
Add more information in QN,13.3.3.1D -MFG Assess potential impact (MFG QNs) 1.00,7,,Fiori QM03: Display Quality Notification (Application)
Add more information in QN,13.3.3.1E -MFG Assess potential impact (MFG QNs) 1.00,19,,
Add new Catalog,4.1.8.1G Catalogs - Code group 1.00,4,Add new Catalog,Fiori QS41: Edit Code Groups (Application)
Add new FS Items,9.3.4.8A Perform legal and management consolidation (Preparatory Activity) 1.00,8,Update or create new FS Items in Define FS Items Application(F3297),Fiori F3297: Define Financial Statement Items for Administrator - Group Reporting (Application)
Add new GR Legal Entity,9.3.4.8A Perform legal and management consolidation (Preparatory Activity) 1.00,12,"Update or create new GR Legal Entity in Define Consolidation Units Application
(F4685)",Fiori F4685: Define Consolidation Units for Administrator - Group Reporting (Application)
Add New Materials to Change Master,4.1.3.1 -FCST Create Unconstrained Plan 3.00,38,,Fiori CC02: Change Change Master (Application)
Add new TBD Slots with all details,4.1.2.1 -EQ-TBD Develop baseline demand forecast - Demand Adjustment 1.00,16,,
Add operations task list,4.1.8.2D Create Equipment Task List 2.00,5,"In the operations tab, define the tasks that need to be performed during the calibration. Each operation can include details like work center, control key, and duration.
Work center will be populated, Operation description to be added as it will be displayed in Purchase requisition/purchase order.
Based on Control key code, the Calibration process is identified as External or Internal. Control key PM02 is used for external calibration. PM01 for Internal .
Upon adding the Control key as PM02, External activity data and Procurement Options fields become mandatory.
External Activity Data:
Order Qty 1 Order qty Unit : EA
Net Price: <XYZ> Currency :SGD
Planned Deliv. Time : 1 days
Cost element : 470500
Material Group :B-OP-EX04
Procurement Options:
Maintenance plant / Purchase Organization : Purchasing Group:
Plant 8200/ Purch Org 8000: H06 Christal KuPlant 3300/ Purch Org 3300: K02 Han DongwonPlant 2000/ Purch Org2000 : E02 Maltie Starkej",Fiori IA01: Create Equipment Task List (Application)
Add participants Supplier level 1 and supplier level 2 approvers,13.3.3.1 -SCR Assess potential impact (Supplier change request) 1.00,13,"There are always two approval levels:
Level 1 by Supplier Manager and
Level 2 by Supplier Quality Engineer or the Subject Matter Expert",SAP EPD: Enterprise Product Development (Application)
"Add Payment Block ""B""",9.6.1.8 -PAY BATCH Process payments (Automatic Payment Run – Batch Job) 1.00,17,,Fiori FB02: Change Document (Application)
Add QN information (problem description),13.3.3.1 -FS Assess potential impact (Field Services QN) 1.00,6,,"Fiori F0312: Quality Notification for Quality Engineer (Application),
Fiori QM02: Change Quality Notification for Quality Engineer (Application)"
Add requester to Active Directory list,13.8.1.2 Provide BIA access 1.00,7,"Access to BIA reports is controlled via Active Directory lists, linked to the BIA report.
The name of the requester will be added to the AD list which is connected to the BIA report",
Add RTS component (Return To Stock),4.3.2.1 Manage raw material inventory (Material Movements from Mfg Floor) 2.00,27,Maintaining components to be received into stock as minus quantity including Appropriate movement Type (262 or 531),Fiori CO02: Change Production Order for Production Supervisor - Discrete Manufacturing (Application)
Add SCR Details,13.3.3.1 -SCR Assess potential impact (Supplier change request) 1.00,12,"Tasks
SCR Submission
SCR Review
SCR Clarification SCR Evaluation
Process Input
Change Notification Letter
Specification and/or datasheet for new part
Technical comparison table for old and new part.
Test data for old and new part if applicable
Cost comparison info if there is pricing change
Cost increase justification if new part is more expensive
Process Output
Change Notification Letter
Specification and/or datasheet for new part
Technical comparison table for old and new part Test data for old and new part if applicable
Cost comparison info if there is pricing change
Cost increase justification if new part is more expensive",SAP EPD: Enterprise Product Development (Application)
Add to Cost Center hierarchies,9.1.3.1 -CC Determine key cost drivers (Maintain Cost Center) 1.00,15,Cost center will be added to the cost center hierarchies according to the request form.,Fiori KSH2: Manage Cost Center Groups for Cost Accountant - Overhead (Application)
Add/remove object to production order,4.3.2.5B Monitor and optimize production process (Modify Prod Ord confirmation) 2.00,15,,
Add/Update tasks in FCC Closing Template,9.3.1.5 Establish common financial systems (FCC) 1.00,25,Add/Update tasks in FCC Closing Template,S/4HANA - FCC (Financial Closing Cockpit) (SAP) (Application)
Adjust demand forecast manual,4.1.3.1 -SP Create Unconstrained Plan 2.00,19,,"Fiori /SAPAPO/SPPFCST: Manage Forecast for Demand Planner - Service Parts (Application),
SAP /SAPAPO/SPPDMDH: SPP Demand History (Application)"
Adjust FG provision after discussion,9.1.2.1 -QTR FG Perform inventory accounting (Quarterly FG Listing) 1.00,9,SU1 Business Analyst to adjust FG provision after discussion with Business Control Director and Controller,
Adjust Outstanding quantity to 0,5.3.3.5 -CO/PS Complete Service Order ZMCO/ ZMPS incl SSD: fld. Change Order/ Prod. Sup. 1.00,10,"Key Activites:
FSE to adjust outstanding quantity(either by return remaining parts to warehouse or consume remaining quantities) to 0",SAP FSM: Field Service Management (Application)
Adjust Outstanding quantity to 0,5.3.3.5 -IQ Complete Service Order ZMIQ: Install & Qualification 1.00,7,"Key Activites:
FSE to adjust outstanding quantity(either by return remaining parts to warehouse or consume remaining quantities) to 0",SAP FSM: Field Service Management (Application)
Adjust Outstanding quantity to 0,"5.3.3.5 -RP Complete Service Order ZMRP: Maintenance, RePair 1.00",28,"Key Activites:
FSE to adjust outstanding quantity(either by return remaining parts to warehouse or consume remaining quantities) to 0",SAP FSM: Field Service Management (Application)
Adjust Outstanding quantity to 0,5.3.3.5 -KM Complete Service Order ZMKM: complete Kit Management 2.00,8,"Key Activites:
FSE to adjust outstanding quantity(either by return remaining parts to warehouse or consume remaining quantities) to 0",SAP FSM: Field Service Management (Application)
Adjust Outstanding quantity to 0,5.3.3.5 -PD Complete Service Order ZMPD: PaiD 1.00,9,"Key Activites:
FSE to adjust outstanding quantity(either by return remaining parts to warehouse or consume remaining quantities) to 0",SAP FSM: Field Service Management (Application)
Adjust safety stock and order quantity levels,4.1.3.1 -SP Create Unconstrained Plan 2.00,29,,
Adjustment of forecast relevant parameters,4.1.2.6 -SP Evaluate and revise demand forecasting approach 2.00,26,,"Fiori /SAPAPO/SPPFCSTPRF: Manage Forecast Profile for Demand Planner - Service Parts (Application),
SAP /SAPAPO/SPPLONGFCST: SPP Long-Term Forecasting (Application)"
Adopt new production schedule,4.3.1.4 Reschedule Production Orders 2.00,10,"Adopt the changes to the production schedule.
T-code: /SAPAPO/CDPS0
App: Advanced Scheduling Board","Fiori F5460: Advanced Scheduling Board (Application),
SAP /SAPAPO/CDPS0: DPS Variable View (Application),
SAP CM21: Capacity leveling. SFC planning table (Application)"
Adopt new production schedule,4.3.1.4 Reschedule Production Orders 2.00,37,"Adopt the changes to the production schedule.
T-code: /SAPAPO/CDPS0
App: Advanced Scheduling Board","Fiori F5460: Advanced Scheduling Board (Application),
SAP /SAPAPO/CDPS0: DPS Variable View (Application)"
Adopt or Save Simulation,4.3.1.4 Reschedule Production Orders 2.00,34,"Save/Adopt Only Applicable to PPDS
Lean PP always adopts",
Advice bank account to transfer to/from,9.6.1.8 -PAY BATCH Process payments (Automatic Payment Run – Batch Job) 1.00,55,,
Aggregate by Production Orders using PowerApp sorting,4.4.3.1B Manage and track inventory deployment 2.00,15,,MS PowerApp (Microsoft) (Application)
Agree on improvement action plans with suppliers,4.2.5.2B Prepare/Analyze procurement and vendor performance 1.00,20,Commodity Managers share the scorecards with the suppliers and follow up in case expectations are not being met. Commodity leads are responsible to define and monitor the minimum threshold and criteria for each of the scorecard components; this may differ from supplier to supplier depending on market and maturity. Results are shared with the supplier and follow-up actions are agreed with the supplier and tracked throughout the quarter to ensure improvement.,
Align Production OrderS,4.3.1.4 Reschedule Production Orders 2.00,28,Change impact more multiple production orders alignment needed,
"Align sales between Sales Operations, Finance, BU BD (Business Development), and GOPS",3.5.2.3 R&C Manage sales/key account plan 1.00,19,,
Allocate approved budget for utilization,9.4.2.3 Monitor and track capital projects and budget spending 1.00,2,,SAP IM52: Process budget distribution (Application)
Amend analysis/reports,9.1.2.3 Perform cost of sales analysis 1.00,9,,SAP AFO: (Analytics For Office) org (Application)
Amend analysis/reports,9.1.2.1 -RPT APPROVAL Perform inventory accounting (Approval) 1.00,4,Make adjustment/amended to the report if necessary.,MS Outlook (Application)
Amend CRM forecast book date (to another month within same quarter),3.5.1.6 R&C Manage opportunity pipeline 1.00,19,,SAP CRM (Customer Relationship Management) (Application)
Amend E&O provision after discussion,9.1.2.1 -QTR E&O Perform inventory accounting (Quarterly E&O) 1.00,14,Business Analyst to adjust E&O provision after discussion with Business Control Manager,
Amend provision,9.1.2.1 -MTHLY E&O Perform inventory accounting (Monthly Excess & Obsolescence) 1.00,12,,
Amend report,9.1.2.1 -MTHLY PDT VAR Perform inventory accounting (Monthly Production Variance) 1.00,17,,
Amend report,9.1.2.1 -MTHLY PPV Perform inventory accounting (Monthly PPV) 1.00,17,,
"Amend sales review ""dry run"" deck",3.5.2.3 R&C Manage sales/key account plan 1.00,4,,
Amend Service Entry Sheet,4.2.4.4C Approve Service Entry Sheet 2.00,5,,Fiori F2027: Manage Service Entry Sheets - Lean Services for Employee - Procurement (Application)
Analyse actual material price movement by material number,9.1.2.5 Perform variance analysis 1.00,6,,
Analyse assembly and testing cycle time for each tool,4.1.1.5 -SP Define Capacities 2.00,10,Analysis is done by comparing the total current month's cycle time to the previous months and past 2 quarters,
Analyse FDT Dashboard/ Scorecard for duties optimization,4.4.4.4 R&C Process and audit carrier invoices and documents 2.00,3,FDT: Freight Duties Tax,
Analyse Impact on Build/Test/BPS,4.1.2.4 Determine available to promise (OFE Change Approval Ticket B Impact Analysis) 2.00,28,,SAP IPS OFE Change Approval ticket Workflow (Order Fulfillment Equipment) (I ) (Application)
Analyse Impact on Customization,4.1.2.4 Determine available to promise (OFE Change Approval Ticket B Impact Analysis) 2.00,22,,SAP IPS OFE Change Approval ticket Workflow (Order Fulfillment Equipment) (I ) (Application)
Analyse Impact on Generic,4.1.2.4 Determine available to promise (OFE Change Approval Ticket B Impact Analysis) 2.00,26,,SAP IPS OFE Change Approval ticket Workflow (Order Fulfillment Equipment) (I ) (Application)
Analyse key purchasing metrics,4.2.5.2B Prepare/Analyze procurement and vendor performance 1.00,30,,
Analyse platform/ regions combinations with below company average turnover rate,4.1.3.1 -SP Create Unconstrained Plan 2.00,57,,
Analyse reason for blocking,11.2.2.6C R&C Monitor and test regulatory compliance position and existing controls (Blocked Sales Transactions) 1.00,10,"To block - sanction parties screening fail, missing export license, missing product classification, China High Risk Customer
To unblock - sanction parties screening pass, valid export license, valid product classification, validated China High Risk Customer",
Analyse report to determine if need to raise journal entry,9.1.2.1 -MTHLY INV RPT Perform inventory accounting (Monthly Inventory Reporting) 1.00,6,,
Analyse spend report,4.2.1.5 R&C Analyze organization’s spend profile 1.00,6,Spend report is analyzed and used to develop commodity strategies,
Analyse YTD cost savings vs target,4.2.1.5 R&C Analyze organization’s spend profile 1.00,12,,
Analyze Accrual Postings,9.3.2.4 -ACCRUAL Process period end adjustments (Accrual Engine) 1.00,14,"After the transaction is completed, GL accountant will retrieve the posted details for review.",Fiori F3732: Analyze Accrual Postings for General Ledger Accountant (Application)
Analyze Cost Component Split for Planned Costs,9.1.2.1 -ADHOC3 ANALYSIS Perform inventory accounting (Adhoc Cost Analysis) 1.00,24,(Analyze Cost Component Split for planned costs: Cost components (Mass)) to download the costing result where there is an option to include the freight adder (% can be entered in the selection screen).,SAP ZCK80_99: Material: Cost Components (Application)
Analyze critical parts review by tool type,4.1.3.1 -SP Create Unconstrained Plan 2.00,43,"Review based on:
- Fill rate performance (based on usage)
- Weekly trend chart for fill rate %
- 0 bin replenishment plan for high/low usage parts used to expedite and allocate parts",Fiori /SAPAPO/SPP_SHORT_MO: Display Shortage Monitor (Application)
Analyze Customer Credit Utilization,9.2.1.5 Review Existing Accounts (Process Credit Limit for Customer) 1.00,8,"Analyze Customer Credit Utilization based on customers past sales volume, value and payment history","Fiori UKM_BP_DISPLAY: Display Credit Master Data - DEPRECATED - (Application),
Fiori UKM_MALUS_DSP: Display Credit Limit Utilization - DEPRECATED (Application)"
Analyze Customer Credit Utilization,9.2.1.5 Review Existing Accounts (Process Credit Limit for Customer) 1.00,13,"Analyze Customer Credit Utilization based on customers past sales volume, value and payment history","Fiori UKM_BP_DISPLAY: Display Credit Master Data - DEPRECATED - (Application),
Fiori UKM_MALUS_DSP: Display Credit Limit Utilization - DEPRECATED (Application)"
Analyze Customer Credit Utilization,9.2.1.5 Review Existing Accounts (Process Credit Limit for Customer) 1.00,28,"Analyze Customer Credit Utilization based on customers past sales volume, value and payment history","Fiori UKM_BP_DISPLAY: Display Credit Master Data - DEPRECATED - (Application),
Fiori UKM_MALUS_DSP: Display Credit Limit Utilization - DEPRECATED (Application)"
Analyze helpdesk ticket,13.8.1.3 Provide BIA help 1.00,15,,
Analyze QN,13.3.3.1 -IM Assess potential impact (Improvement-Manual QN) 1.00,16,"Intake of a QN contains the following activities:
Make sure there is enough information to understand the problem
Classify the most possible defect, cause code and cause department",Fiori QM03: Display Quality Notification (Application)
Analyze QN,13.3.3.1E -MFG Assess potential impact (MFG QNs) 1.00,3,"Intake of a QN contains the following activities:
Make sure there is enough information to understand the problem
Classify the most possible defect, cause code and cause department
The Production Review Board (PRB) consist of several functions, and is lead by....
Manufacturing Engineer decide on ..
Manufacturing Quality Engineer decide on ...
Supplier Quality Engineer decide on
Contract Manufacturing Quality decide on...
The Buyer takes care of replacement if needed
Lead by area owner
Main participants:
Detection function
ME to decide function
MQE to decide customer impact
SQE to acknowledge supplier cause
CMQ to acknowledge CM cause
Logistics to acknowledge Logistics
cause
Planner / Buyer / EFT buyer to arrange
for replacement if involve physical
part (optional)",Fiori QM02: Change Quality Notification for Quality Engineer (Application)
Analyze QN,13.3.3.1D -MFG Assess potential impact (MFG QNs) 1.00,21,"Intake of a QN contains the following activities:
Make sure there is enough information to understand the problem
Classify the most possible defect, cause code and cause department
The Production Review Board (PRB) consist of several functions, and is lead by are owner.
Main participants:
Detection function
ME to decide function
MQE to decide customer impact
SQE to acknowledge supplier cause
CMQ to acknowledge CM cause
Logistics to acknowledge Logistics
cause
Planner / Buyer / EFT buyer to arrange
for replacement if involve physical
part (optional)",Fiori QM02: Change Quality Notification for Quality Engineer (Application)
Analyze QN,13.3.3.1 -FS Assess potential impact (Field Services QN) 1.00,9,"Check the assigned defect code and classify the possible cause code and cause department.
Check if there is a complete and clear problem description describing what, when where and how long the problem ocurred.","Fiori QM02: Change Quality Notification for Quality Engineer (Application),
Fiori QM03: Display Quality Notification (Application),
Fiori QM11: Display Quality Notifications - Worklist (Application)"
Analyze the affected tools and communicate to CCM,"13.3.3.1E.1 SPDA (Non short ship-Type 1)GOPS 8200,3300,GSS 3118 Ariba supplier 1.00",49,,
Announce delivery receival to shipment requestor,"4.4.4.1 Plan, transport and deliver outbound product 2.00",28,,MS Office (Application)
Announce shipment booking details to requestor,"4.4.4.1 Plan, transport and deliver outbound product 2.00",4,,
Any quality issues with Parts Received,4.3.2.2F Execute detailed line schedule (exception handling 1.00,13,,
Apply BOM redlining,2.5.4.1 ETO Sub-System Design 1.00,49,"System task Applies the approved redline bom created with process:
Approve Redline Material BOM (sharepoint.com)",SAP IPS ETO Ticket Workflow (Engineer To Order) ( (Application)
Apply Delivery Block,3.5.4.5A Enter Sales Orders into system 1.00,98,RICEF ID- 2696,
Apply Delivery Z1 block,3.5.4.5A Enter Sales Orders into system 1.00,114,(Z1 Approval needed),
Apply MRP Change Request and PO line items is updated,4.2.4.4B Distribute Purchase Order 2.00,31,,"SAP ARIBA - SCC - MM (Application),
SAP ZMM_MRP_CR: MRP Change Request (Application)"
Appraise suppliers,4.2.5.2B Prepare/Analyze procurement and vendor performance 1.00,26,Pending final decision Power BI or Fiori app to be used to appraise suppliers,"Fiori F1650: Evaluate Suppliers for Employee - Procurement (Application),
Power BI (Microsoft) (Application)"
Appraise suppliers,4.2.5.2B Prepare/Analyze procurement and vendor performance 1.00,16,Pending final decision Power BI or Fiori app to be used to appraise suppliers,"Fiori F1650: Evaluate Suppliers for Employee - Procurement (Application),
Power BI (Microsoft) (Application)"
Approval,3.5.4.7C Process back orders and updates (OFE Change Approval Ticket D Implementation) 4.3.1.4 1.00,7,Manager reviews Order BOM update and decides to approve or reject,SAP IPS OFE Change Approval ticket Workflow (Order Fulfillment Equipment) (I ) (Application)
Approval,2.5.4.1 ETO Sub-System Design 1.00,12,"ObjectiveThe purpose of this task is to do a sanity check on the materials, and material BOM's on the ER, to prevent missing items or incorrect demands being created at a later stage.
Tasks Execute the Perform BOM Manager Approval task from the Business workflow inbox. Make sure that the created BOM structures are compared, and are in accordance with the Customer Order Specification Form.
Validate the impact on costs.
Review the key date (Valid From Date of the BOM) before BOM approval.
Ensure that the BOM item categories used are of the correct type (no BOM items X, Y, or Z)",SAP IPS ETO Ticket Workflow (Engineer To Order) ( (Application)
Approval by GAM,5.3.3.5 -PD Complete Service Order ZMPD: PaiD 1.00,32,,SAP SWI1: Selection report for workflows (Application)
Approve BOM,2.5.3.2 -iPLM Manufacturing Preparation Request 1.00,26,,SAP IPS iPLM Manufacturing Preparation ticket workflow (Application)
Approve budget for next year,9.1.2.4 -ACVT RATE Perform product costing (Maintain Activity Rate) 1.00,2,"Budget data is planned in Anaplan.
The annual plan/budget data is used for this process flow.
Activity rates are calculated/ simulated either manually or by the SAP test system during the budget process. These will be approved by the Business Controller after completion of the budget process and released in S4 production version.
Cost driver and SKF/ allocation key will be determined during the annual budget process prior to final budget approval.
Incoming freight adder will be calculated during budget process.",ANAPLAN (Finacial Planning & Analyses) (Application)
Approve Changes,4.1.5.1 -EQ Maintain master data 1.00,14,,
Approve contract (Object),4.2.3.3 -CONTRACT Negotiate and establish contracts 1.00,26,,Fiori F0862: My Inbox for Manager (Application)
Approve PIR creation /update request,4.2.3.4B Manage Purchase Info Record 2.00,9,,HaloITSM MDM (Master Data Management) (Application)
Approve PR generated by planning run,4.1.3.1 -SP Create Unconstrained Plan 2.00,16,PR: Purchase Requestions,"Fiori /SAPAPO/SPP_ALERT_MO: Display Alert Monitor (Application),
Fiori /SAPAPO/SPP_ALERT_SU: Display Alert Summary (Application),
Fiori /SAPAPO/SPP_COCKPIT: Display eSPP Cockpit (Application),
Fiori /SAPAPO/SPP_NOTE_ANA: Manage Analyst Note (Application),
Fiori /SAPAPO/SPP_SHORT_MO: Display Shortage Monitor (Application),
Fiori /SAPAPO/SPP_SHORT_OV: Display Shortage Overview (Application),
SAP /SAPAPO/SPP_NOTE_DEL: Delete Analyst Node (Application),
SAP /SAPAPO/SPP_PLN_LIST: Planner’s Worklist (Application),
SAP /SAPAPO/SPP_SCHD_EXP: Explanation Prog. for SPP Scheduler (Application),
SAP /SAPAPO/SPPINBD: SPP Inbound Delivery Monitor - Standard Times (Application)"
Approve Project,4.1.2.4 Determine available to promise (OFE Change Approval Ticket B Impact Analysis) 2.00,19,"Based on the analysis from PM/PL/CC/ME, determine whether the change(s) can be managed before the system shipment. Decision based on below:
Approved: If GOPS can manage the change
Reject/Return to Marketing: If the change cannot be managed by GOPS OR If any amendment required from Marketing (eg. request to split ticket, wrong info in ticket etc) ; Task will then be returned to BU marketing",SAP IPS OFE Change Approval ticket Workflow (Order Fulfillment Equipment) (I ) (Application)
Approve Purchase Order,4.2.4.4A Create/Distribute Purchase Orders 2.00,5,Approved,"Fiori F0862: My Inbox for Manager (Application),
Fiori ME29N: Release Purchase Order (Application)"
Approve requisition,4.2.4.2 Approve requisitions 1.00,6,,Fiori F0862: My Inbox for Manager (Application)
